COOPER-STANDARD AUTOMOTIVE INC.,21439,cooper-standard automotive,cooper-standard,Standard,122995,89.4,cooper-standard automotive,Standard Automotive,57712,96.8,cooper-standard automotive,Standard Automotive,57712,96.8,
COTT HOLDINGS INC.,24178,cott holdings,cott,Cottco Holdings,125429,98.6,cott holdings,Jeffcott Holdings,2352,97.4,cott holdings,Jeffcott Holdings,2352,97.4,cott
CSN Resources S.A.,4231,csn resources,csn,CSN Mineracao On,80527,89.6,csn resources,CN Resources,128841,92.8,csn resources,CN Resources,128841,92.8,
Caisse Regionale de Credit Agricole Mutuel Nor,8494,caisse regionale de credit agricole mutuel nor,caisse,Caisse Registered Cred Agriculture Mutual Tourain Poitou,91719,93.8,caisse regionale,Caisse Regionale Credit,15597,93.4,caisse regionale de,Caisse Regionale Credit,165484,84.6,CAISSE regionale
Caisse Regionale de Credit Agricole Mutuel Pyr,8476,caisse regionale de credit agricole mutuel pyr,caisse,Caisse Regionale Credit,165484,93.4,caisse regionale,Caisse Regionale Credit,15597,93.4,caisse regionale de,Caisse Regionale Credit,165487,84.6,CAISSE regionale
Caisse Regionale de Credit Agricole Mutuel de,8518,caisse regionale de credit agricole mutuel de,caisse,Caisse Regionale Credit,165487,93.6,caisse regionale,Caisse Regionale Credit,165487,93.6,caisse regionale de,Caisse Regionale Credit,165486,84.8,CAISSE regionale
Caisse Regionale de Credit Agricole Mutuel de,8496,caisse regionale de credit agricole mutuel de,caisse,Caisse Regionale Credit,165487,93.6,caisse regionale,Caisse Regionale Credit,165487,93.6,caisse regionale de,Caisse Regionale Credit,165486,84.8,CAISSE regionale
"Capital One Bank (USA), National Association",21267,capital one bank (usa) national association,capital,Capital Bank Financial Class A,59337,92.6,capital one,Capital One (Frankfurt) Financial DS,255412,92.6,capital one bank,Capital One,15645,88.2,Capital One
Capital One Capital II,20795,capital one capital ii,capital,Calpine Capital Trust III,70804,96.6,capital one,Capital One Financial,133051,94.8,capital one capital,Capital One,15645,93.4,Capital One
Capital One Capital III,22906,capital one capital iii,capital,Calpine Capital Trust III,70804,97.2,capital one,Capital One Financial,133051,94.6,capital one capital,Capital One,15645,93.0,Capital One
Capital One Capital IV,22297,capital one capital iv,capital,Capstone Capital Trust,63294,95.8,capital one,Capital One Financial,133051,94.8,capital one capital,Capital One,15645,93.4,Capital One
Capital One Capital V,22852,capital one capital v,capital,Capstone Capital Trust,63294,96.2,capital one,Capital One Financial DS,193753,95.2,capital one capital,Capital One,15645,93.8,
Capital One Capital VI,22926,capital one capital vi,capital,Capstone Capital Trust,63294,95.8,capital one,Capital One Financial DS,185048,94.8,capital one capital,Capital One,15645,93.4,Capital One
"Capital One, F.S.B.",21967,capital one f.s.b.,capital,Capital One,15645,95.2,capital one,Capital One,15645,95.2,capital one f.s.b.,Capital One,15645,95.2,Capital One
"Capital One, National Association",21208,capital one national association,capital,Capital One Financial DS,185048,93.6,capital one,Capital One Financial DS,193754,93.6,capital one national,Capital One,15645,90.2,Capital One
"Capital One, National Association",24755,capital one national association,capital,Capital One Financial DS,185048,93.6,capital one,Capital One Financial DS,193754,93.6,capital one national,Capital One,15645,90.2,Capital One
Centel Capital Corporation,21014,centel capital corporation,centel,Centel Cable Television,63408,92.2,centel capital,Capital Trust,99352,88.4,centel capital corporation,Capital Corporation,24927,96.8,Centel
"China Railway 15th Bureau Group Co.,Ltd.",6656,china railway 15th bureau group co.ltd.,china,China Railway Group 'H',162542,93.0,china railway,China Railway Group 'A',87546,93.0,china railway 15th,INA,65640,82.8,China Railway
"China Railway 21st Bureau Group Co.,Ltd.",6675,china railway 21st bureau group co.ltd.,china,China Railway Group 'H',162542,93.0,china railway,China Railway Group 'H',162542,93.0,china railway 21st,INA,65640,82.8,China Railway
"China Railway 24th Bureau Group Co., Ltd.",6790,china railway 24th bureau group,china,China Railway Group 'H',162542,94.0,china railway,China Railway Group 'H',162542,94.0,china railway 24th,INA,65640,83.6,China Railway
China Railway Beijing Engineering Bureau Group,7261,china railway beijing engineering bureau group,china,China Energy Engineering 'A',153829,92.4,china railway,China Railway Tielong Container Logistic 'A',88344,91.6,china railway beijing,INA,65640,82.4,China Railway
China Railway Construction Bridge Engineering,6723,china railway construction bridge engineering,china,China State Construction Engineering 'A',87431,95.0,china railway,China Railway Construction 'H' (XETRA),290747,94.4,china railway construction,China Railway Construction 'H',162541,94.4,China Railway
China Railway Construction Investment Group Co,6974,china railway construction investment group co,china,China Railway Construction Heavy Industry 'A',88302,94.6,china railway,China Railway Construction Heavy Industry 'A',88302,94.6,china railway construction,China Railway Construction Heavy Industry 'A',88302,94.6,China Railway
China Railway SIYUAN Survey and Design Group C,7212,china railway siyuan survey and design group c,china,China Infrastructure and Logistics Group,99507,92.0,china railway,China Railway Signal and Communication Company Limited,165677,91.8,china railway siyuan,INA,65640,82.4,China Railway
China Railway SIYUAN Survey and Design Group C,7178,china railway siyuan survey and design group c,china,China Infrastructure and Logistics Group,99507,92.0,china railway,China Railway Signal and Communication Company Limited,165677,91.8,china railway siyuan,INA,65640,82.4,China Railway
China Railway Wuhan Electrification Engineerin,7275,china railway wuhan electrification engineerin,china,China Railway HS Electrification Equipment 'A',91883,95.6,china railway,China Railway HS Electrification Equipment 'A',91883,95.6,china railway wuhan,INA,65640,82.4,China Railway
"China Railway XunJie Co., Limited",25353,china railway xunjie,china,China Railway Group 'H',162542,94.0,china railway,China Railway Group 'H',162542,94.0,china railway xunjie,INA,65640,85.2,China Railway
Citibank Canada,5032,citibank canada,citibank,Citibank Canada Warrants,143324,95.4,citibank canada,Citibank Canada Warrants,143324,95.4,citibank canada,Citibank Canada Warrants,143324,95.4,Citigroup
"Citibank Colombia, S.A.",7317,citibank colombia,citibank,Citibank Mexico B,25173,94.2,citibank colombia,Security Bank,57405,87.6,citibank colombia,Security Bank,57405,87.6,Citigroup
Citibank Credit Card Issuance Trust,21914,citibank credit card issuance,citibank,Citibank Canada Warrants,143324,92.0,citibank credit,Security Bank,200310,84.8,citibank credit card,Security Bank,200310,84.8,Citigroup
Citibank International plc,17069,citibank international,citibank,Citibank Mexico SA,173141,93.0,citibank international,Bank International,221177,98.0,citibank international,Bank International,221177,98.0,Citigroup
Citibank International plc,15126,citibank international,citibank,Citibank Mexico SA,173141,93.0,citibank international,Bank International,221177,98.0,citibank international,Bank International,221177,98.0,Citigroup
Citibank International plc,9096,citibank international,citibank,Citibank Mexico SA,173141,93.0,citibank international,Bank International,221177,98.0,citibank international,Bank International,221177,98.0,Citigroup
Citibank Leasing SA Arrendamento Mercantil,4125,citibank leasing arrendamento mercantil,citibank,Citibank Canada Warrants,143324,92.0,citibank leasing,Security Bank,200310,83.8,citibank leasing arrendamento,Trust Bank,86763,83.8,Citigroup
Citibank NA (New York Branch),24905,citibank na (new york branch),citibank,Citibank Canada Warrants,143324,92.8,citibank na,Citibank Canada Warrants,143324,85.6,citibank na (new,Citibank N A New York Preferred Series B,143325,88.0,Citigroup
Citibank del Peru S.A.,16794,citibank del peru,citibank,Citibank Portugal R,177949,93.4,citibank del,AB Bank,80936,87.6,citibank del peru,AB Bank,80936,87.6,Citigroup
"Citibank, N.A.",10328,citibank n.a.,citibank,Citibank Mexico SA,173141,92.8,citibank n.a.,Trust Bank,86763,89.4,citibank n.a.,Trust Bank,86763,89.4,Citigroup
"Citibank, N.A.",9243,citibank n.a.,citibank,Citibank Mexico SA,173141,92.8,citibank n.a.,Trust Bank,86763,89.4,citibank n.a.,Trust Bank,86763,89.4,Citigroup
"Citibank, N.A.",21234,citibank n.a.,citibank,Citibank Mexico SA,173141,92.8,citibank n.a.,Trust Bank,86763,89.4,citibank n.a.,Trust Bank,86763,89.4,Citigroup
"Citibank, N.A.",21847,citibank n.a.,citibank,Citibank Mexico SA,173141,92.8,citibank n.a.,Trust Bank,86763,89.4,citibank n.a.,Trust Bank,86763,89.4,Citigroup
"Citibank, N.A.",5129,citibank n.a.,citibank,Citibank Mexico SA,173141,92.8,citibank n.a.,Trust Bank,86763,89.4,citibank n.a.,Trust Bank,86763,89.4,Citigroup
Citigroup Capital Korea Inc,14263,citigroup capital korea,citigroup,Citigroup Capital Trust IX 6%,59456,95.6,citigroup capital,Citigroup Capital Trust IX 6%,59456,95.6,citigroup capital korea,Citigroup,25175,91.2,Citigroup
Citigroup Capital XVII,20809,citigroup capital xvii,citigroup,Citigroup Capital VII 7.125%,63584,96.8,citigroup capital,Citigroup Capital VII 7.125%,63584,96.8,citigroup capital xvii,Citigroup Capital VII 7.125%,63584,92.8,Citigroup
Citigroup Capital XVIII,22368,citigroup capital xviii,citigroup,Citigroup Capital Trust IX 6%,59456,96.6,citigroup capital,Citigroup Capital Trust IX 6%,59456,96.6,citigroup capital xviii,Citigroup Capital Xiii 7 Preference,138975,92.0,Citigroup
Citigroup Finance Canada Inc.,5031,citigroup finance canada,citigroup,Citigroup (Ireland),231837,94.0,citigroup finance,Citigroup,132933,91.0,citigroup finance canada,Citigroup,132933,91.0,Citigroup
Citigroup Finance Canada ULC,5402,citigroup finance canada ulc,citigroup,Citigroup (Ireland),231837,92.8,citigroup finance,Citigroup,25175,89.8,citigroup finance canada,Citigroup,132933,89.8,Citigroup
Citigroup Global Markets Brasil Corretora de C,4132,citigroup global markets brasil corretora de c,citigroup,Citigroup Global Markets Elks Yahoo,194109,94.4,citigroup global,Citigroup Global Markets Elks Yahoo,194109,94.4,citigroup global markets,Citigroup Global Markets Elks Yahoo,194109,94.4,Citigroup
Citigroup Global Markets Deutschland AG,7673,citigroup global markets deutschland,citigroup,Citigroup Global Markets Elks,194108,96.6,citigroup global,Citigroup Global Markets Elks,194108,96.6,citigroup global markets,Citigroup Global Markets Elks,194108,96.6,Citigroup
Citigroup Global Markets Funding Luxembourg GP,15387,citigroup global markets funding luxembourg gp,citigroup,Citigroup Global Markets Index Lasers,78865,95.0,citigroup global,Citigroup Global Markets Index Lasers,78865,95.0,citigroup global markets,Citigroup Global Markets Index Lasers,78865,95.0,Citigroup
Citigroup Global Markets Funding Luxembourg SC,15257,citigroup global markets funding luxembourg sc,citigroup,Citigroup Global Markets Index Lasers,78865,95.4,citigroup global,Citigroup Global Markets Index Lasers,78865,95.4,citigroup global markets,Citigroup Global Markets Index Lasers,78865,95.4,Citigroup
Citigroup Global Markets Japan Inc.,13520,citigroup global markets japan,citigroup,Citigroup Global Markets Elks,194108,97.0,citigroup global,Citigroup Global Markets Elks,194108,97.0,citigroup global markets,Citigroup Global Markets Elks,194108,97.0,Citigroup
Citigroup Japan Holdings Corp.,13559,citigroup japan holdings corp.,citigroup,Citigroup Global Markets Holdings Elks,194113,93.0,citigroup japan,Citigroup,132933,89.2,citigroup japan holdings,Citigroup,25175,89.2,Citigroup
Citigroup Korea Inc.,14384,citigroup korea,citigroup,Citigroup (Kaz),251272,96.0,citigroup korea,Citigroup,25175,95.0,citigroup korea,Citigroup,25175,95.0,Citigroup
Citizens Bank,22145,citizens bank,citizens,Citizens Bancorp,128798,96.6,citizens bank,Citizens Bankshares,71194,96.2,citizens bank,Citizens Bankshares,71194,96.2,
Covidien International Finance S.A.,15180,covidien international finance,covidien,Covidien (XETRA),305390,90.4,covidien international,International,206505,92.0,covidien international finance,National Finance,43130,94.0,Covidien
D'ieteren,2446,d'ieteren,d'ieteren,SA d'Ieteren NV,21729,97.2,d'ieteren,SA d'Ieteren NV,21729,97.2,d'ieteren,SA d'Ieteren NV,21729,97.2,
DKT Holdings ApS,7920,dkt holdings aps,dkt,Dkti,7263,88.0,dkt holdings,Trust Holdings,51235,93.4,dkt holdings aps,AG Holdings,44740,93.4,
Delek Petroleum Ltd.,11158,delek petroleum,delek,Delek Group,97548,93.8,delek petroleum,Elk Petroleum,215305,92.2,delek petroleum,Elk Petroleum,215305,92.2,delek
Digicel International Finance Ltd,15072,digicel international finance,digicel,Digicel Group Class A,64269,90.4,digicel international,International,206505,92.4,digicel international finance,National Finance,43130,94.2,Digicel
Dime Community Bank,22259,dime community bank,dime,Dime Community Bancshares,59683,96.4,dime community,Dime Community Bancshares,134072,96.4,dime community bank,Community Bank,71262,97.0,
Dolphin Energy Limited,2705,dolphin energy,dolphin,Blue Dolphin Energy,128432,97.0,dolphin energy,Blue Dolphin Energy,128432,97.0,dolphin energy,Blue Dolphin Energy,128432,97.0,
Drax Holdings Limited,9086,drax holdings,drax,Draxis Health,7328,90.8,drax holdings,Trust Holdings,114528,95.2,drax holdings,Trust Holdings,114528,95.2,Drax
"Duke Energy Kentucky, Inc.",21176,duke energy kentucky,duke,Duke Energy (XETRA),262704,94.4,duke energy,Duke Energy (XETRA),262704,94.4,duke energy kentucky,Duke Energy,157761,94.2,
E.ON International Finance B.V.,16198,e.on international finance b.v.,e.on,Pheonix International Life Science I,208717,74.39999999999999,e.on international,International,206505,91.8,e.on international finance,National Finance,43130,93.6,E.ON
ELLI INVESTMENTS LIMITED,9533,elli investments,elli,Mellin Industries,55957,93.4,elli investments,Investments,42565,96.2,elli investments,Investments,42565,96.2,ELLI
EnBW International Finance B.V.,16185,enbw international finance b.v.,enbw,Enbw Energie Baden-Wuerttemberg,87506,89.0,enbw international,International,206505,91.8,enbw international finance,National Finance,112023,93.6,EnBW
Enel Finance International S.A.,15181,enel finance international,enel,Enel Generacion Chile,88570,92.0,enel finance,Enel,87375,85.4,enel finance international,International,206505,93.4,Enel
Equitable Bank,5100,equitable bank,equitable,Equitable PCI Bank,34364,97.6,equitable bank,Equitable,115126,95.6,equitable bank,Equitable,115126,95.6,
Essar Energy Investment Limited,12452,essar energy investment,essar,Essar Energy (XETRA),311775,94.0,essar energy,Essar Energy (XETRA),311775,94.0,essar energy investment,Essar Energy,46959,93.8,Essar
FAGE International S.A.,15345,fage international,fage,Fagerlid Industrier,42098,90.8,fage international,International,206505,96.8,fage international,International,206505,96.8,FAGE Dairy Industry
FEDBANK FINANCIAL SERVICES LIMITED,11677,fedbank financial services,fedbank,Security Bank,107132,85.4,fedbank financial,Financial Securities,72530,90.2,fedbank financial services,Financial Services,109572,96.4,
FKp Limited,3440,fkp,fkp,FKP Property Group (Non-NASDAQ OTC),236448,83.2,fkp,FKP Property Group (Non-NASDAQ OTC),236448,83.2,fkp,FKP Property Group (Non-NASDAQ OTC),236448,83.2,
"Favorite Brands International, Inc.",21421,favorite brands international,favorite,Guru Favorite Stocks ETF,187088,89.8,favorite brands,Brand,99265,85.8,favorite brands international,International,206505,92.4,
GE Capital Interbanca S.p.A.,12149,ge capital interbanca,ge,GE Capital Bank,167005,95.6,ge capital,GE Capital Bank,167005,95.6,ge capital interbanca,Interbanca,18826,93.0,GE Capital
GEO COAL INTERNATIONAL PTE. LTD.,17967,geo coal international pte.,geo,Geo International,54616,95.4,geo coal,Geo,109832,84.0,geo coal international,Coal International,46190,96.0,
GKN Holdings plc,9069,gkn holdings,gkn,GKN Publishing,65125,92.4,gkn holdings,Trust Holdings,114528,96.0,gkn holdings,Trust Holdings,114528,96.0,GKN
GRAN TIERRA ENERGY INTERNATIONAL HOLDINGS LTD.,15013,gran tierra energy international holdings,gran,Gran Tierra Energy (Toronto),212524,94.0,gran tierra,Gran Tierra Energy (Toronto),212524,94.0,gran tierra energy,Gran Tierra Energy (Toronto),212524,94.0,GRAN TIERRA
Gmac International Finance B.V.,16132,gmac international finance b.v.,gmac,GMAC Pines 7.30%,144791,88.6,gmac international,International,206505,91.8,gmac international finance,National Finance,43130,93.6,GMAC
"Gome Holdings Group Co., Ltd.",6959,gome holdings group,gome,Gomero Group,119128,94.2,gome holdings,Trust Holdings,114528,91.8,gome holdings group,Trust Holdings,51235,91.8,
H&R Real Estate Investment Trust,4932,h&r real estate investment,h&r,H&R Real Estate Investment Trust Staple Unit,80611,96.2,h&r real,H&R Real Estate Investment Trust Staple Unit,80611,96.2,h&r real estate,H&R Real Estate Investment Trust Staple Unit,80611,96.2,
HANDELSBANKEN PLC,9908,handelsbanken,handelsbanken,Andelsbanken,5104,99.2,handelsbanken,Andelsbanken,5104,99.2,handelsbanken,Andelsbanken,5104,99.2,
"HC2 HOLDINGS, INC.",20445,hc2 holdings,hc2,HC2 Holdings Warrants 'A3' 01/07/2014,205989,89.8,hc2 holdings,Trust Holdings,114528,96.0,hc2 holdings,Trust Holdings,114528,96.0,HC2
HETA ASSET RESOLUTION AG,2880,heta asset resolution,heta,Hetan Technologies,35215,90.2,heta asset,Theta Asset Management AS2 4.40% AUG27 ETF,150067,89.6,heta asset resolution,Asset Resolution,81360,97.2,
Henson International Finance Ltd,10375,henson international finance,henson,Stephensons Rental Services Income Fund,12583,90.2,henson international,International,206505,92.6,henson international finance,National Finance,43130,94.6,Henson
Hitachi International Treasury Ltd,17805,hitachi international treasury,hitachi,Hitachi (SEAQ International),221867,94.4,hitachi international,International,206505,92.0,hitachi international treasury,International,206505,92.0,
Hypo Real Estate International Trust I,22366,hypo real estate international i,hypo,Hypo Real Estate Holding,18553,94.2,hypo real,Hypo Real Estate Holding,18553,94.2,hypo real estate,Hypo Real Estate Holding,18553,94.2,
IBM International Group Capital LLC,22387,ibm international group capital,ibm,IBM CAD Hedged Continental Depositary Receipts,154878,88.8,ibm international,International,206505,91.8,ibm international group,AB International Group,127814,95.2,
ICAP Group Holdings PLC,9396,icap group holdings,icap,Icape Holding,93571,95.0,icap group,TP ICAP Group,124853,92.4,icap group holdings,APX Group Holdings Inc,70084,96.0,ICAP
"ICG Holdings, Inc.",21287,icg holdings,icg,ICG Holdings Canada 'A',8842,93.8,icg holdings,AG Holdings,44740,96.0,icg holdings,AG Holdings,44740,96.0,ICG
ITT HOLDINGS LLC,24157,itt holdings,itt,Ittifak Holding,119920,96.2,itt holdings,AG Holdings,44740,96.0,itt holdings,AG Holdings,44740,96.0,ITT
Iaws Group PLC,2503,iaws group,iaws,Iaws Group 'A' (London),295234,92.2,iaws group,Securities Group,21982,93.4,iaws group,Securities Group,21982,93.4,
JCB FINANCE S.A.S.,8617,jcb finance,jcb,Jcbnext,110707,91.2,jcb finance,Jacob Finance,101627,91.2,jcb finance,Jacob Finance,101627,91.2,JCB
JM FINANCIAL SERVICES LIMITED,11680,jm financial services,jm,KJMC Financial Services,102050,99.0,jm financial,KJMC Financial Services,102050,92.6,jm financial services,Financial Services,109572,98.4,
Jinmao (China) Investments Holdings Limited,10521,jinmao (china) investments holdings,jinmao,China Jinmao Holdings Group,97456,91.6,jinmao (china),Hi,26603,82.2,jinmao (china) investments,Investments,42565,89.6,China JinMao
Jupiter International Group PLC,9045,jupiter international group,jupiter,Jupiter National,197270,94.8,jupiter international,International,206505,93.0,jupiter international group,AB International Group,127814,96.6,
KEB HANA BANK,17817,keb hana bank,keb,Keba Oil and Gas,65934,91.0,keb hana,Hana Securities,35106,89.4,keb hana bank,Hana Bank,178818,96.4,
KEB HANA BANK,3663,keb hana bank,keb,Keba Oil and Gas,65934,91.0,keb hana,Hana Securities,35106,89.4,keb hana bank,Hana Bank,178818,96.4,
KGI INTERNATIONAL HOLDINGS LIMITED,14840,kgi international holdings,kgi,Ykgi Holdings,114991,92.4,kgi international,Kangli International Holdings,101889,94.2,kgi international holdings,International Holdings,79284,98.4,KGI
LAND SECURITIES P L C,9031,land p l c,land,Calanda P,177803,92.6,land p,Midland Plastics,28297,92.4,land p l,Land,111227,91.4,
LIN Television Corporation,21376,lin television corporation,lin,Lines Television Corporation,74366,99.2,lin television,Television,51019,91.2,lin television corporation,Vision Corporation,105724,96.4,
"LPL HOLDINGS, INC.",22035,lpl holdings,lpl,Willplus Holdings,114889,96.6,lpl holdings,Holdings,206120,96.0,lpl holdings,Holdings,206120,96.0,LPL
"LYB INTERNATIONAL FINANCE III, LLC",24914,lyb international finance iii,lyb,International Molybdenum,48139,91.4,lyb international,International,206505,92.4,lyb international finance,National Finance,43130,94.2,
M&T Capital Trust I,21358,m&t capital i,m&t,M&T Bank (MIC),225050,90.4,m&t capital,Security Capital,200314,94.0,m&t capital i,Security Capital,76742,94.0,
"MMH HOLDINGS, INC.",21606,mmh holdings,mmh,Lammhults Design Group,179484,89.4,mmh holdings,Trust Holdings,51235,96.0,mmh holdings,Trust Holdings,51235,96.0,MMH
MONY Life Insurance Company,21423,mony life insurance company,mony,Mony Life Insurance Company of America,66631,96.6,mony life,Mony Life Insurance Company of America,66631,96.6,mony life insurance,Mony Life Insurance Company of America,66631,96.6,
MPH ACQUISITION HOLDINGS LLC,23848,mph acquisition holdings,mph,Symphony Holdings,105051,93.6,mph acquisition,MDH Acquisition Units,189105,89.6,mph acquisition holdings,SP Acquisition Holdings,200576,95.6,MPH
NB FINANCE LTD.,14971,nb finance,nb,HNB Finance,119459,99.0,nb finance,HNB Finance,119459,99.0,nb finance,HNB Finance,119459,99.0,NB
NRW.BANK,7643,nrw.bank,nrw.bank,Security Bank,107132,93.4,nrw.bank,Security Bank,107132,93.4,nrw.bank,Security Bank,107132,93.4,
"New York & Company, Inc.",20349,new york & company,new,News World Wu Company,121307,95.4,new york,New York Times Company 'B',198573,95.4,new york &,New York Times Company 'B',198573,87.39999999999999,
Ngex Resources Inc,4753,ngex resources,ngex,Ngex Resources (XETRA),314006,95.6,ngex resources,Ngex Resources (XETRA),314006,95.6,ngex resources,Ngex Resources (XETRA),314006,95.6,ngex resources
"Nissan Financial Services Co., Ltd.",13523,nissan financial services,nissan,Nissan France,20555,92.6,nissan financial,Financial Trust,64753,90.6,nissan financial services,Financial Services,109572,96.8,Nissan
Nomura Bank International plc,9052,nomura bank international,nomura,Nomura Holdings (SEAQ International),222411,94.4,nomura bank,Nomura,112291,87.8,nomura bank international,Bank International,221176,96.8,
Nordic Investment Bank,8215,nordic investment bank,nordic,Nordic Investmen,28902,96.8,nordic investment,Nordic Investmen,28902,96.8,nordic investment bank,Nordic Investmen,28902,96.8,
OHL Investments S.A.,15267,ohl investments,ohl,Kohls Brazilian Depositary Receipt,149549,89.0,ohl investments,Investments,42565,97.0,ohl investments,Investments,42565,97.0,OHL
"ONEMAIN FINANCIAL HOLDINGS, INC.",24015,onemain financial holdings,onemain,Onemain Holdings,134764,95.2,onemain financial,Securities Financial,57376,90.2,onemain financial holdings,Financial Trust,64753,90.2,
OP Financial Ltd,10264,op financial,op,Peoples Financial,131268,96.6,op financial,Financial Securities,72530,97.2,op financial,Financial Securities,72530,97.2,OP
P2P Global Investments PLC,9661,p2p global investments,p2p,P2P Transport,3171,89.2,p2p global,Global,109885,88.6,p2p global investments,Global Investments,119073,98.0,P2P
"PECO Energy Capital, L.P.",21464,peco energy capital,peco,Peco Energy Company,75847,95.8,peco energy,Peco Energy Company,75847,95.8,peco energy capital,Peco Energy Capital Trust I Preferred Trust Receipt,146507,93.2,
"PICO Holdings, Inc.",20392,pico holdings,pico,Pico Holdings (XETRA),307805,95.2,pico holdings,Holdings,206120,95.2,pico holdings,Holdings,206120,95.2,
"PMX INDUSTRIES, INC.",21533,pmx industries,pmx,PMX Communities,56834,92.4,pmx industries,AG Industries,32001,96.6,pmx industries,AG Industries,32001,96.6,
PQ GROUP HOLDINGS INC.,24540,pq group holdings,pq,Umpqua Holdings,135209,95.0,pq group,Q Group,49941,91.6,pq group holdings,PS Group Holdings,38450,94.0,
PT Bank Commonwealth,10847,pt bank commonwealth,pt,Opta Minerals,10830,91.0,pt bank,T Bank,22692,89.2,pt bank commonwealth,Common,99799,89.2,PT Bank
Pain Therapeutics Inc,20401,pain therapeutics,pain,Pain Therateutics (XETRA),307672,95.2,pain therapeutics,Rain Therapeutics,138008,94.0,pain therapeutics,Rain Therapeutics,138008,94.0,Pain Therateutics
QR National Limited,3496,qr national,qr,QR National (XETRA),314921,94.6,qr national,National,10379,96.8,qr national,National,10379,96.8,
ROAD MANAGEMENT CONSOLIDATED PLC,8995,road management consolidated,road,Lang Son Road Management and Consolidated,126211,96.2,road management,Lang Son Road Management and Consolidated,126211,96.2,road management consolidated,Consolidated Securities,99851,92.0,
"RWT HOLDINGS, INC",24050,rwt holdings,rwt,CLRWT Seafoods Income Fund,157333,88.4,rwt holdings,AG Holdings,44740,96.0,rwt holdings,AG Holdings,44740,96.0,RWT
Repsol International Finance BV,16116,repsol international finance bv,repsol,Repsol SA (SEAQ International),296774,93.8,repsol international,Repsol International Capital Preferred 'A' 7.45%,146873,92.6,repsol international finance,National Finance,112023,93.6,Repsol
S&T Bank,22229,s&t bank,s&t,S&T Bancorp,134965,94.8,s&t bank,T Bank,22692,97.2,s&t bank,T Bank,22692,97.2,
S.P.C.M. SA,8472,s.p.c.m.,s.p.c.m.,PCM,60930,64.6,s.p.c.m.,PCM,60930,64.6,s.p.c.m.,PCM,60930,64.6,
