Target Name,Target No.,preprocessed,Focus Text,Shortest Match Name,Shortest Match No.,Non-NASDAQ OTC Match Name,Non-NASDAQ OTC Match No.,Matched Name 1,Matched No. 1,Matched Score 1,Matched Name 2,Matched No. 2,Matched Score 2,Matched Name 3,Matched No. 3,Matched Score 3,Matched Name 4,Matched No. 4,Matched Score 4,Matched Name 5,Matched No. 5,Matched Score 5,Matched Name 6,Matched No. 6,Matched Score 6,Matched Name 7,Matched No. 7,Matched Score 7,Matched Name 8,Matched No. 8,Matched Score 8,Matched Name 9,Matched No. 9,Matched Score 9,Matched Name 10,Matched No. 10,Matched Score 10
ATF Netherlands B.V.,16423,atf netherlands b.v.,atf,ATF Bank,14817.0,,,Vasta Platform Limited Class B,201668,99.48,Platfields,38129,99.47,Glatfelter,136748,99.47,Glatfelter (Berlin),263391,99.47,Platfields (Berlin),288610,99.47,Glatfelter (XETRA),306111,99.47,Platfields (XETRA),314732,99.47,Hatfield Estates,47719,99.44,Arco Platform Limited Class B,192970,99.44,Multi Platform Integration,56079,99.43
Autopista Concesionaria Astur-Leonesa S.A.,8012,autopista concesionaria astur leonesa,autopista,Autopista-Vasco,24463.0,,,Autopista Los Libertadores SA,5382,99.57000000000001,Autopistas del Sol,81475,99.51,Autopistas del Sol (Non-NASDAQ OTC),243926,99.51,Autopista-Vasco,24463,99.5,Society Conces Autopista Interportuaria SA,12373,99.47,Auto Group,447,99.2,Ista Investment,145278,99.2,IST Group,35820,99.15,STA Group,43876,99.15,Top,86659,99.15
"AUTOPISTA DEL GUADALMEDINA, CONCESIONARIA ESPA",8164,autopista del guadalmedina concesionaria espa,autopista,Autopista-Vasco,24463.0,,,Autopista Los Libertadores SA,5382,99.54,Autopistas del Sol,81475,99.51,Autopistas del Sol (Non-NASDAQ OTC),243926,99.51,Autopista-Vasco,24463,99.43,Society Conces Autopista Interportuaria SA,12373,99.43,Auto Group,447,99.16,Ista Investment,145278,99.16,IST Group,35820,99.12,STA Group,43876,99.12,Top,86659,99.12
Autopista Fernao Dias S.A.,4319,autopista fernao dias,autopista,Autopista-Vasco,24463.0,,,Autopista-Vasco,24463,99.67,Autopistas del Sol,81475,99.67,Autopistas del Sol (Non-NASDAQ OTC),243926,99.67,Autopista Los Libertadores SA,5382,99.64,Society Conces Autopista Interportuaria SA,12373,99.5,Auto Group,447,99.32,Ista Investment,145278,99.32,IST Group,35820,99.25,STA Group,43876,99.25,Top,86659,99.25
Autopista Litoral Sul S.A.,4321,autopista litoral sul,autopista,Autopista-Vasco,24463.0,,,Autopistas del Sol,81475,99.72,Autopistas del Sol (Non-NASDAQ OTC),243926,99.72,Autopista Los Libertadores SA,5382,99.68,Autopista-Vasco,24463,99.67,Society Conces Autopista Interportuaria SA,12373,99.5,Auto Group,447,99.32,Ista Investment,145278,99.32,IST Group,35820,99.25,STA Group,43876,99.25,Top,86659,99.25
Autopista Planalto Sul S.A.,4320,autopista planalto sul,autopista,Autopista-Vasco,24463.0,,,Autopistas del Sol,81475,99.7,Autopistas del Sol (Non-NASDAQ OTC),243926,99.7,Autopista-Vasco,24463,99.65,Autopista Los Libertadores SA,5382,99.62,Society Conces Autopista Interportuaria SA,12373,99.46,Auto Group,447,99.31,Ista Investment,145278,99.31,IST Group,35820,99.24,STA Group,43876,99.24,Top,86659,99.24
Autopista Regis Bittencourt S.A.,4318,autopista regis bittencourt,autopista,Autopista-Vasco,24463.0,,,Autopista-Vasco,24463,99.62,Autopista Los Libertadores SA,5382,99.6,Autopistas del Sol,81475,99.58,Autopistas del Sol (Non-NASDAQ OTC),243926,99.58,Society Conces Autopista Interportuaria SA,12373,99.48,Auto Group,447,99.26,Ista Investment,145278,99.26,IST Group,35820,99.2,STA Group,43876,99.2,Top,86659,99.2
"Autopista Tenango-Ixtapan de la Sal, S.A. de C",15657,autopista tenango ixtapan de la sal de c,autopista,Autopista-Vasco,24463.0,,,Autopista Los Libertadores SA,5382,99.55,Autopistas del Sol,81475,99.55,Autopistas del Sol (Non-NASDAQ OTC),243926,99.55,Autopista-Vasco,24463,99.47,Society Conces Autopista Interportuaria SA,12373,99.41,Auto Group,447,99.18,Ista Investment,145278,99.18,IST Group,35820,99.14,STA Group,43876,99.14,Top,86659,99.14
"Autopistas Del Atlantico, C.E.S.A",8002,autopistas del atlantico c.e.s.a,autopistas,Autopistas del Sol,81475.0,Autopistas del Sol (Non-NASDAQ OTC),243926.0,Autopistas del Sol,81475,99.64,Autopistas del Sol (Non-NASDAQ OTC),243926,99.64,Auto Group,447,99.22,Stas,39565,99.22,Ista Investment,145278,99.22,IST Group,35820,99.17,STA Group,43876,99.17,Top,86659,99.17,IST Limited,101603,99.17,TAS (XETRA),315984,99.17
AXA Equitable Life Insurance Company,21303,axa equitable life insurance,axa,AXA,87376.0,AXA (Non-NASDAQ OTC),243958.0,AXA Midi Assurances,14922,99.6,AXA Courtage Vie Limited Data Dead,14919,99.52,AXA Versicherung Preference (XETRA),165024,99.51,AXA Versicherung Preference,165025,99.51,AXA Asia Pacific Holdings,483,99.5,AXA Asia Pacific Holdings,227194,99.5,AXA Asia Pacific Holdings (Frankfurt),276932,99.5,AXA Asia Pacific (XETRA) Holdings,310096,99.5,AXA Financial,62778,99.49,AXA Financial (Berlin),299736,99.49
AXA HOME LOAN SFH SA,8644,axa home loan sfh,axa,AXA,87376.0,AXA (Non-NASDAQ OTC),243958.0,Paxan Electronics,37951,99.53,Maxar Technologies (New York),134606,99.51,Maxar Technologies,213209,99.51,Maxar Technologies (Frankfurt),264574,99.51,AXA Konzern,14920,99.5,AXA Konzern (XETRA),14921,99.5,AXA Stenman,14924,99.5,Axantis Holding,41332,99.5,Axactor ASA,108120,99.5,Axantis Holding AG,177472,99.5
AXA Investment Managers,9281,axa managers,axa,AXA,87376.0,AXA (Non-NASDAQ OTC),243958.0,AXA New,165020,99.63,AXA New,165021,99.63,AXA New,165022,99.63,AXA Konzern,14920,99.61,AXA Konzern (XETRA),14921,99.61,AXA Stenman,14924,99.61,Laxapana Batteries,120535,99.6,AXA Midi Assurances,14922,99.58,AXA Financial,62778,99.56,AXA Financial (Berlin),299736,99.56
Banca Popolare di Ancona SpA,12190,banca popolare di ancona spa,banca,Banca Ifis,88029.0,Banca Carige (Non-NASDAQ OTC),234523.0,Banca Popolare di Novara,15138,99.85,Banca Popolare di Novara,15144,99.85,Banca Popolare di Novara (Stuttgart),293537,99.85,Banca Popolare di Lajatico Scpa,91372,99.85,Banca Popolare di Milano,14993,99.81,Banca Popolare di (Non-NASDAQ OTC) Milano,234525,99.81,Banca Popolare di (Frankfurt) Milano,276969,99.81,Banca Popolare di (XETRA) Milano,284538,99.81,Banca Popolare di Verona (VIRT-X),293538,99.81,Banca Popolare di Verona (XETRA),310144,99.81
Banca Popolare di Aprilia - S.p.A.,12246,banca popolare di aprilia,banca,Banca Ifis,88029.0,Banca Carige (Non-NASDAQ OTC),234523.0,Banca Popolare di Milano,14993,99.86,Banca Popolare di Novara,15138,99.86,Banca Popolare di Novara,15144,99.86,Banca Popolare di (Non-NASDAQ OTC) Milano,234525,99.86,Banca Popolare di (Frankfurt) Milano,276969,99.86,Banca Popolare di (XETRA) Milano,284538,99.86,Banca Popolare di Novara (Stuttgart),293537,99.86,Banca Popolare Italiana,14995,99.83,Banca Popolare Italiana (Stuttgart),293446,99.83,Banca Popolare Emilia (VIRT-X),293539,99.83
Banca Popolare di Lanciano e Sulmona SpA,12222,banca popolare di lanciano e sulmona spa,banca,Banca Ifis,88029.0,Banca Carige (Non-NASDAQ OTC),234523.0,Banca Popolare di Cividale Scpa,91370,99.73,Banca Popolare di Lajatico Scpa,91372,99.73,Banca Popolare di Puglia E Basilicata,91373,99.73,Banca Popolare di Milano Conversion Rights,165082,99.71,Banca Popolare Luino E Varese,15145,99.7,Banca Popolare di Bari ORS,91369,99.7,Banca Popolare di Milano,14993,99.69,Banca Popolare di Novara,15138,99.69,Banca Popolare di Novara,15144,99.69,Banca Popolare di (Non-NASDAQ OTC) Milano,234525,99.69
Banca Popolare di Lodi Investor Trust III,22005,banca popolare di lodi investor iii,banca,Banca Ifis,88029.0,Banca Carige (Non-NASDAQ OTC),234523.0,Banca Popolare di Spoleto,14996,99.73,Banca Popolare di Sondrio,87704,99.73,Banca Popolare di Sondrio (Stuttgart),268351,99.73,Banca Popolare di Sondrio (XETRA),310223,99.73,Banca Popolare di Milano Conversion Rights,165082,99.73,Banca Popolare di Lecco,24645,99.72,Banca Popolare di Fondi,91371,99.72,Banca Popolare di Bari ORS,91369,99.72,Banca Popolare di Milano,14993,99.71,Banca Popolare di Novara,15138,99.71
Banca Popolare di Mantova SpA,12238,banca popolare di mantova spa,banca,Banca Ifis,88029.0,Banca Carige (Non-NASDAQ OTC),234523.0,Banca Popolare di Novara,15138,99.87,Banca Popolare di Novara,15144,99.87,Banca Popolare di Novara (Stuttgart),293537,99.87,Banca Popolare di Milano,14993,99.83,Banca Popolare di (Non-NASDAQ OTC) Milano,234525,99.83,Banca Popolare di (Frankfurt) Milano,276969,99.83,Banca Popolare di (XETRA) Milano,284538,99.83,Banca Popolare di Lajatico Scpa,91372,99.83,Banca Popolare Novara (VIRT-X),293543,99.8,Banca Popolare di Cividale Scpa,91370,99.8
Banca Popolare di Ravenna SpA,12198,banca popolare di ravenna spa,banca,Banca Ifis,88029.0,Banca Carige (Non-NASDAQ OTC),234523.0,Banca Popolare di Verona (VIRT-X),293538,99.83,Banca Popolare di Verona (XETRA),310144,99.83,Banca Popolare di Cividale Scpa,91370,99.8,Banca Popolare di Lajatico Scpa,91372,99.8,Banca Popolare di Novara,15138,99.79,Banca Popolare di Novara,15144,99.79,Banca Popolare di Novara (Stuttgart),293537,99.79,Banca Popolare Siracusa,15146,99.77,Banca Popolare Verona (Frankfurt),293545,99.76,Banca Popolare di Bari ORS,91369,99.76
BANCA POPOLARE DI VICENZA SOCIETA PER AZIONI,12184,banca popolare di vicenza societa per azioni,banca,Banca Ifis,88029.0,Banca Carige (Non-NASDAQ OTC),234523.0,Banca Popolare di Cividale Scpa,91370,99.69,Banca Popolare di Novara,15138,99.68,Banca Popolare di Novara,15144,99.68,Banca Popolare di Novara (Stuttgart),293537,99.68,Banca Popolare di Verona (VIRT-X),293538,99.68,Banca Popolare di Verona (XETRA),310144,99.68,Banca Popolare di Spoleto,14996,99.67,Banca Popolare di Sondrio,87704,99.67,Banca Popolare di Sondrio (Stuttgart),268351,99.67,Banca Popolare di Sondrio (XETRA),310223,99.67
Barclaycard Funding PLC,9074,barclaycard funding,barclaycard,,,,,RCL Group,3525,99.27,Car,24933,99.27,Arc Group,52363,99.27,Arc International (Non-NASDAQ OTC),52364,99.27,Arc Finance,98656,99.27,Car (HKSE Connect Equity),221329,99.27,Car (SZS),221330,99.27,Arc International,231567,99.27,Arc International (VIRT-X),231568,99.27,Car (Non-NASDAQ OTC),235105,99.27
"BBVA 3 FTPYME,Fondo de Titulizacion de Activos",8036,bbva 3 ftpymefondo de titulizacion de activos,bbva,BBVA (Tokyo),221220.0,BBVA (Non-NASDAQ OTC),244070.0,BBVA - BMV Mexico Enlace RT Trac,173011,99.47,BBVA - BMV Mexico Construye RT Trac,173010,99.43,BBVA - BMV Mexico CSO Frecuente RT Trac,171650,99.43,BBVA Sponsored ADR (Frankfurt) 1:1,255180,99.42,BBVA Sponsored ADR (XETRA) 1:1,290656,99.42,BBVA Capital Privado F C R,162420,99.42,BBVA Accion IBEX 35 ETF,162419,99.41,BBVA Dow Jones STOXX Euro 50,162421,99.41,BBVA Privanza International Preferred C Gibraltar ADR 1:1,142682,99.41,BBVA Banco Frances (XETRA) Sponsored ADR 1:3,317006,99.4
