Target Name,Target No.,preprocessed,Focus Text,Shortest Match Name,Shortest Match No.,Non-NASDAQ OTC Match Name,Non-NASDAQ OTC Match No.,Matched Name 1,Matched No. 1,Matched Score 1,Matched Name 2,Matched No. 2,Matched Score 2,Matched Name 3,Matched No. 3,Matched Score 3,Matched Name 4,Matched No. 4,Matched Score 4,Matched Name 5,Matched No. 5,Matched Score 5,Matched Name 6,Matched No. 6,Matched Score 6,Matched Name 7,Matched No. 7,Matched Score 7,Matched Name 8,Matched No. 8,Matched Score 8,Matched Name 9,Matched No. 9,Matched Score 9,Matched Name 10,Matched No. 10,Matched Score 10
ENERGEST S.A.,4279,energest,energest,,,,,ERG,34373,99.55,GES International,34848,99.55,ERG,88581,99.55,ERG,109401,99.55,ERG (Non-NASDAQ OTC),205050,99.55,GES International (Australian),215426,99.55,ERG (Non-NASDAQ OTC),236210,99.55,ERG (Frankfurt),269970,99.55,ERG (SEAQ International),294614,99.55,ERG (Berlin),300819,99.55
ENERGIE RENOUVELABLE BROOKFIELD INC.,5112,energie renouvelable brookfield,energie,Energie Versorgung,1581.0,BKW FMB Energie (Non-NASDAQ OTC),234713.0,EDF Energies Nouvelles,16834,99.6,EDF Energies Nouvelles (Frankfurt),278349,99.6,EDF Energies Nouvelles (XETRA),311575,99.6,Meshek Energy Renewable Energies,102612,99.57000000000001,Energie Baden-Wuerttembe RG AG,166605,99.55,Energie Electrique Simplon,42018,99.53,Energie Electrique Simplon,178385,99.53,Energiedienst Holding,115583,99.5,Energiedienst Holding,178376,99.5,Energiedienst Holding,178377,99.5
ENERGUATE TRUST,10044,energuate,energuate,,,,,ERG,34373,99.5,ERG,88581,99.5,ERG,109401,99.5,ERG (Non-NASDAQ OTC),205050,99.5,ERG (Non-NASDAQ OTC),236210,99.5,ERG (Frankfurt),269970,99.5,ERG (SEAQ International),294614,99.5,ERG (Berlin),300819,99.5,ERG (XETRA),311758,99.5,RG Investment,21568,99.36
ENERGY EFFICIENCY SERVICES LIMITED,11743,energy efficiency services,energy,Energy,79025.0,Nextraction Energy (Non-NASDAQ OTC),247536.0,Emerge Energy Services (Frankfurt),278413,99.71,Delaney Energy Services,7139,99.69,Enserco Energy Services,7644,99.69,Energy Reserves Group,64530,99.68,Enseco Energy Services,7643,99.67,ESI Energy Services,7697,99.67,Leader Energy Services,9622,99.67,MSI Energy Services,10316,99.67,NQL Energy Services,10679,99.67,VKG Energy Services,44399,99.67
ENERGY FUTURE COMPETITIVE HOLDINGS COMPANY LLC,21077,energy future competitive,energy,Energy,79025.0,Nextraction Energy (Non-NASDAQ OTC),247536.0,Energy Recovery,134127,99.65,Energy Recovery (Frankfurt),262866,99.65,Energy Recovery (XETRA),305757,99.65,4ENERGY Street (D),164560,99.62,Energy Infrastructure Acquisition,54058,99.62,Energy Reserves Group,64530,99.6,Energy Plus Income Trust,7622,99.6,Energy WTR Development,129296,99.6,Energy Transfer Equity (XETRA),305759,99.6,WRT Energy Preferred Convertible,202049,99.6
ENERPEIXE S.A.,4409,enerpeixe,enerpeixe,,,,,ERP,59841,99.5,IX,27142,99.36,Ei Group,46815,99.36,Ei Group (Frankfurt),278368,99.36,X,13869,99.2,Eneres,25810,82.84,Enher,17176,79.77000000000001,Gener,17874,79.77000000000001,ENER1,54048,79.77000000000001,Enero Group,82831,79.77000000000001
ENGIE Transmissao de Energia Participacoes S.A,4511,engie transmissao de energia participacoes,engie,Engie,87447.0,Engie (Non-NASDAQ OTC),245333.0,Engie Brasil Energia On,80570,99.62,Engie Energia Chile,92555,99.56,Engie Energia Peru,106501,99.53,Engie BRA Energia Sponsored ADR 1:1,185945,99.52,Engie BRA Energia Sponsored (Frankfurt) ADR 1:1,255759,99.52,Frcaise Engie Prom,92797,99.47,Engie Sponsored ADR (Frankfurt),255760,99.43,Engie Sponsored ADR 1:1,185946,99.4,Engie,87447,99.21,Engie (Mexico),217581,99.21
ENN Clean Energy International Investment Limi,7139,enn clean energy limi,enn,ENN Energy Holdings,97147.0,ENN Energy Holdings (Non-NASDAQ OTC),245339.0,Pennant Energy,11098,99.69,Pennant Energy (Non-NASDAQ OTC),238987,99.69,Pennant Energy (Frankfurt),281001,99.69,Pennant Energy (XETRA),314598,99.69,ENN Energy Holdings,97147,99.65,ENN Energy Holdings (Temp),166610,99.65,ENN Energy Holdings (Temp),166611,99.65,ENN Energy Holdings (HKSE Connect Equity),217583,99.65,ENN Energy Holdings (Mexico),217584,99.65,ENN Energy Holdings (SZS),217585,99.65
Enogex LLC,21332,enogex,enogex,,,,,OG International,75533,99.5,X,13869,99.29,O-Bank,115989,99.29,Gexa,72994,85.74,Enegex,82814,83.0,Engtex Group,109367,83.0,Xenogen,78462,82.94,Endogen,79024,82.94,Xenogen (Frankfurt),297991,82.94,Xenogen (XETRA),309187,82.94
ENTIDAD DE DESARROLLO A LA PEQUENA Y MICRO EMP,16841,entidad de desarrollo a la pequena y micro emp,entidad,Coomeva Entidad Promotora de Salud,6820.0,,,Coomeva Entidad Promotora de Salud,6820,99.38,ENT,1607,99.12,Da Securities,25386,99.08,Da Group,46473,99.08,ID Holdings,110369,99.08,TI Group,183594,99.08,TI Group,201171,99.08,Da Group (Frankfurt),294221,99.08,Da Group (XETRA),311283,99.08,T Bank,22692,99.04
ENTRA EIENDOM AS,16561,entra eiendom as,entra,Entra,106503.0,Entra (Non-NASDAQ OTC),245349.0,Central Vietnam Metal,125316,99.65,Central Termica Buenos Aires,151039,99.64,Central Information,33180,99.63,Banco Central Hispano ADR,193526,99.63,Banco Central Hispano ADR (Toronto),216423,99.63,Central Coast,1053,99.62,Entra Data,42027,99.62,Gentraco Feed,47389,99.62,Central Proteina (Stuttgart),268885,99.62,Central Doea ANA,6978,99.62
ENTRA KULTUR 1 AS,16575,entra kultur 1 as,entra,Entra,106503.0,Entra (Non-NASDAQ OTC),245349.0,Central Euro CT-At,78842,99.63,Bank Central Asia,97089,99.62,Bank Central Asia (Non-NASDAQ OTC),244014,99.62,Bank Central Asia (Frankfurt),268243,99.62,Bank Central Asia (XETRA),310162,99.62,Central Coast,1053,99.6,Central Glass,106401,99.6,Entra Data,42027,99.59,Central Australia Group,82406,99.59,Central Tumaco,6980,99.58
ENTREPRISES CARA LIMITEE,5409,entreprises cara limitee,entreprises,Finatech Entreprises,17554.0,,,Auxiliar d'Entreprises Limited Data,14890,99.55,Compagnie D Entreprises CFE,92004,99.55,Compagnie D (Frankfurt) Entreprises CFE,269251,99.55,Sovac Entreprises,22408,99.54,Finatech Entreprises,17554,99.5,Eprise,72315,99.4,Eprise (Frankfurt),294603,99.4,Eprise (XETRA),305806,99.4,Rise,113139,99.29,Rise (Frankfurt),281531,99.29
ENVEN ENERGY CORPORATION,24461,enven energy corporation,enven,Wuxi HGNG Enven Group 'A',90579.0,,,Enventis,59828,99.44,Enventis (Berlin),285991,99.44,Wuxi HGNG Enven Group 'A',90579,99.33,Wuxi HGNG Enven Group (SSE Connect Equities) 'A',214278,99.33,NVE,137680,99.22,NVE (Frankfurt),265087,99.22,NVE (XETRA),307478,99.22,V Group,132515,99.08,Veon,164289,85.43,Veon (MIC),226895,85.43
Environmental ESG Participacoes S.A.,4546,environmental esg participacoes,environmental,Growth Environmental,73192.0,Blumetric Environmental (Non-NASDAQ OTC),244221.0,Environmental Resources,34354,99.74,Environmental Resources,178391,99.74,Environmental Energy Services,54097,99.73,Environmental Tectonics,129326,99.7,Environmental Solutions (Berlin),300799,99.7,Environmental Safeguards,72294,99.69,Security Environmental Systems,76743,99.69,Security Environmental Systems,200316,99.69,Environmental Recovery,1612,99.68,Environmental Reclamation,7655,99.68
ENW FINANCE PLC,9404,enw,enw,,,,,Enwa,34356,99.86,Tenwow International Holdings,30902,99.67,Fenway International,54266,99.67,Enwave,82856,99.67,Senwes,122539,99.67,Enwave (Non-NASDAQ OTC),245354,99.67,Enwave (Frankfurt),262908,99.67,Tenwow International Holdings (Frankfurt),282352,99.67,Enwave (XETRA),285997,99.67,Kenwood,27511,99.6
EOLICA HERMENEGILDO II S.A.,4357,eolica hermenegildo ii,eolica,,,,,LIC,27863,99.24,ICA AB,42475,99.24,ICA AB,178994,99.24,ICA AB,178995,99.24,ICA (Non-NASDAQ OTC),237135,99.24,ICA (Empresas) (SEAQ International),241976,99.24,ICA (Frankfurt),271146,99.24,ICA (XETRA),312656,99.24,IC Group,8836,99.17,IC,35427,99.17
EON Bank Berhad,15822,eon berhad,eon,EON Capital,25835.0,EON NRG (Non-NASDAQ OTC),236191.0,Leong Hup International Berhad,27846,99.77,Veon ADR (Pet),252557,99.67,EON Capital Berhad A,173321,99.67,Hong Leong Bank Berhad 'A',173562,99.65,Aeon Hokkaido,106271,99.61,EON Metals (Suspended 28/05/92),1615,99.6,Veoneer,61718,99.59,Veoneer (Pet),240703,99.59,Veoneer (Frankfurt),282766,99.59,EON NRG,82857,99.59
Epistar Corporation,18380,epistar corporation,epistar,Epistar GDR 144A,205037.0,,,Epistar GDR (Registered Share),241675,99.6,Epistar GDR 144A,205037,99.57000000000001,Epistar GDR Registered Share,205038,99.47,Istar,134450,99.42,Istar (Frankfurt),264036,99.42,Star Holdings,30520,99.35,Star Group Company,104812,99.35,Star,122998,99.35,International Star,130232,99.35,Star Group,138381,99.35
Equa bank a.s.,7411,equa a.s.,equa,,,,,Equals Group,125662,99.67,Equals Group (Berlin),269959,99.67,Sequa 'A',68073,99.67,Sequa 'A' (Berlin),303008,99.67,Sequana,22028,99.62,Sequana (Frankfurt),281732,99.62,Sequana (XETRA),315389,99.62,Equasens,88578,99.59,Equasens (Frankfurt),269960,99.59,Sequa,50445,99.57000000000001
EQUATE Petrochemical B.V.,16425,equate petrochemical b.v.,equate,,,,,At-Group,24421,99.15,At Trust,45099,99.15,UA Group,51292,99.15,T Bank,22692,99.08,Q Group,49941,99.08,Q (XETRA),314901,99.08,Atea,106329,85.42,Atec,117041,85.42,Atec,128190,85.42,Atea (BRN),223866,85.42
