Target Name,Target No.,preprocessed,Focus Text,Shortest Match Name,Shortest Match No.,Non-NASDAQ OTC Match Name,Non-NASDAQ OTC Match No.,Matched Name 1,Matched No. 1,Matched Score 1,Matched Name 2,Matched No. 2,Matched Score 2,Matched Name 3,Matched No. 3,Matched Score 3,Matched Name 4,Matched No. 4,Matched Score 4,Matched Name 5,Matched No. 5,Matched Score 5,Matched Name 6,Matched No. 6,Matched Score 6,Matched Name 7,Matched No. 7,Matched Score 7,Matched Name 8,Matched No. 8,Matched Score 8,Matched Name 9,Matched No. 9,Matched Score 9,Matched Name 10,Matched No. 10,Matched Score 10
FortisBC Holdings Inc.,5036,fortisbc,fortisbc,,,,,Fortis,17676,99.86,Fortis (B) AG,17677,99.86,Fortis Bank,42174,99.86,Fortis,80304,99.86,Fortis (B) AG,166886,99.86,Fortis (BRN),227662,99.86,Fortis (Swiss Stock Exchange),227663,99.86,Fortis (New York),251503,99.86,Fortis (Frankfurt),263203,99.86,Fortis Bank (Frankfurt),278799,99.86
FortisBC Inc.,5079,fortisbc,fortisbc,,,,,Fortis,17676,99.86,Fortis (B) AG,17677,99.86,Fortis Bank,42174,99.86,Fortis,80304,99.86,Fortis (B) AG,166886,99.86,Fortis (BRN),227662,99.86,Fortis (Swiss Stock Exchange),227663,99.86,Fortis (New York),251503,99.86,Fortis (Frankfurt),263203,99.86,Fortis Bank (Frankfurt),278799,99.86
Fortress Paper Ltd.,4783,fortress paper,fortress,Fortress Minerals,118876.0,Fortress REIT B (Non-NASDAQ OTC),241758.0,Fortress Investment (Mexico) Group A,221686,99.83,Fortressa,301004,99.78,Fortress Energy,215380,99.76,Fortress Energy (Berlin),286447,99.76,Fortress Energy (XETRA),312009,99.76,Fortress Holdings,47247,99.73,Fortress Investment Group,59952,99.73,Fortress Group,72759,99.73,Fortress Investment Group (Frankfurt),278801,99.73,Fortress Group (Berlin),301003,99.73
Forum Servicios Financieros S.A.,5762,forum servicios financieros,forum,Hotel Forum,8739.0,Forum Energy (Non-NASDAQ OTC),236505.0,Iforum Financial Network,8864,99.59,Forum Merger II Units,205392,99.58,Forum Merger III Units,205393,99.57000000000001,Forum Pacific,109654,99.55,Forum Merger IV Units,186420,99.54,Inforum Communications,55251,99.53,Forum Energy,47249,99.51,Forum Energy,215382,99.51,Forum Energy (Non-NASDAQ OTC),236505,99.51,Forum Energy (Stuttgart),278807,99.51
Fospar S.A. Fertilizantes Fosfatados do Parana,4452,fospar fertilizantes fosfatados do parana,fospar,,,,,Spar Group,115285,99.18,Spar Group,138354,99.18,Spar Group (Non-NASDAQ OTC),248955,99.18,Spar Group (Berlin),266211,99.18,Spar Group (Berlin),274690,99.18,Spa International,77051,99.14,FOS,92780,99.14,FOS Holdings,92781,99.14,FOS Holdings,286452,99.14,AR,24258,99.09
FOSSE MASTER ISSUER PLC,9317,fosse master issuer,fosse,La Fosse Platinum,9527.0,,,La Fosse Platinum,9527,99.56,La Fosse Platinum Warrants 89,159323,99.46,Arendals Fossekompani,106320,99.4,Arendals (Non-NASDAQ OTC) Fossekompani,234319,99.4,Arendals (Frankfurt) Fossekompani,267910,99.4,Bjolvefossen,32849,99.32,FOS,92780,99.27,FOS Holdings,92781,99.27,SSE,124455,99.27,SSE (BRN),225790,99.27
Foz Centro Norte S.A.,4290,foz centro norte,foz,,,,,Oz Group,94977,99.22,Z Group PLC,51849,99.12,Z Holdings,106153,99.12,O-Bank,115989,99.12,F Investment Trust Group,125685,99.12,Z Holdings (Non-NASDAQ OTC),250027,99.12,Z Holdings (Frankfurt),276205,99.12,Netinfo,94732,79.55,ABS Minel Trafo,31912,79.52000000000001,Trefo,40191,79.49000000000001
Foz do Rio Claro Energia S.A.,4561,foz do rio claro energia,foz,,,,,Oz Group,94977,99.15,Z Group PLC,51849,99.08,Z Holdings,106153,99.08,O-Bank,115989,99.08,F Investment Trust Group,125685,99.08,Z Holdings (Non-NASDAQ OTC),250027,99.08,Z Holdings (Frankfurt),276205,99.08,ABS Minel Trafo,31912,79.51,Berdichivs FO,41411,79.42,Netinfo,94732,79.39
FPC Finance Limited,25257,fpc,fpc,FPC Capital I Quips A 7.10%,59962.0,,,FP Holdings,47259,99.8,FP Group,54464,99.8,FP,106525,99.8,PC Group,131241,99.8,PC Group (Berlin),288494,99.8,C Holdings,24873,99.5,F Investment Trust Group,125685,99.5,FPC Capital I Quips A 7.10%,59962,99.2,UBS Uefpcb Exchange-Traded Note,141689,99.18,UBS Efpca 10FEB23 Exchange-Traded Note,141660,99.15
FPC Treasury Limited,25283,fpc treasury,fpc,FPC Capital I Quips A 7.10%,59962.0,,,FPC Capital I Quips A 7.10%,59962,99.36,UBS Uefpcb Exchange-Traded Note,141689,99.33,FP Holdings,47259,99.29,FP Group,54464,99.29,FP,106525,99.29,PC Group,131241,99.29,PC Group (Berlin),288494,99.29,UBS Efpca 10FEB23 Exchange-Traded Note,141660,99.28,C Holdings,24873,99.15,F Investment Trust Group,125685,99.15
FQM (Akubra) Inc,5315,fqm,fqm,,,,,Q Group,49941,99.5,F Investment Trust Group,125685,99.5,Q (XETRA),314901,99.5,CFM,6391,67.0,FCM,25934,67.0,FFM,25953,67.0,FMC,26024,67.0,FSM Holdings Limited,26063,67.0,FDM Group,47096,67.0,FMB Holdings,47212,67.0
FQM (Akubra) Inc.,5255,fqm,fqm,,,,,Q Group,49941,99.5,F Investment Trust Group,125685,99.5,Q (XETRA),314901,99.5,CFM,6391,67.0,FCM,25934,67.0,FFM,25953,67.0,FMC,26024,67.0,FSM Holdings Limited,26063,67.0,FDM Group,47096,67.0,FMB Holdings,47212,67.0
FREEPORT MINERALS CORPORATION,24127,freeport minerals corporation,freeport,Freeport,232096.0,Freeport (Non-NASDAQ OTC),72801.0,Freeport Mcmoran,64959,99.67,Freeport-Mcmoran,133054,99.67,Freeport Mcmoran (Australian),216493,99.67,Freeport-Mcmoran (Mexico),217688,99.67,Freeport Mcmoran (ZRH),224573,99.67,Freeport-Mcmoran (MIC),224574,99.67,Freeport-Mcmoran (Kaz),251513,99.67,Freeport-Mcmoran (Lima),251514,99.67,Freeport-Mcmoran (Santiago),251515,99.67,Freeport-Mcmoran (Frankfurt),263241,99.67
Friesland Bank N.V.,16149,friesland n.v.,friesland,Foremost Friesland,42166.0,,,Foremost Friesland,42166,99.56,Frieslandcampina Engro Pakistan,109671,99.49,Foremost Friesland Foreign Board,232088,99.48,Land Securities Group PLC,48475,99.44,Land,111227,99.44,Land Securities Group,124533,99.44,Land Securities (VIRT-X),232374,99.44,Land Securities Group (Non-NASDAQ OTC),246837,99.44,Land Securities Group (Frankfurt),271880,99.44,Land Securities Group (XETRA),313217,99.44
FSBS CAPITAL TRUST I,21913,fsbs capital i,fsbs,,,,,SBS Group,50336,99.35,SBS Holdings,107125,99.35,SBS Holdings (Non-NASDAQ OTC),248613,99.35,SBS Group (Berlin),302962,99.35,BS,24840,99.25,FS Group,34727,99.25,F Investment Trust Group,125685,99.13,CFSB,71055,85.47,SFSB,131826,85.47,Fossal I,175042,74.89
F-Secure Oyj,8191,f secure oyj,f,Fundia F,178625.0,FRTS First Cumulative Redeemable (Non-NASDAQ OTC) Series F Preference,250253.0,F-Secure (XETRA),311866,99.8,Efore OYJ,166551,99.67,Securesoft,39034,99.64,Nforce Secure,121327,99.64,F-Secure Corporation,92655,99.62,F-Secure (Frankfurt) Corporation,270113,99.62,Esecuresoft,129350,99.61,FG Europe Property,166811,99.6,Nforce Secure NVDR,175948,99.6,Secure Fortress,50406,99.59
FTA Santander Consumer Spain Auto 06,8062,fta santander consumer spain auto 06,fta,,,,,Ftac Parnassus Acquisition A,136666,99.5,Ftac Athena Acquisition A,136664,99.49,Ftac Athena Acquisition Units,186648,99.49,Ftac Emerald Acquisition A,136665,99.48,Ftac Hera Acquisition Units,186652,99.48,Ftaczeusacquisition Corporation Class B,195893,99.48,Ftac Athena Acquisition Corporation Class B,195888,99.48,Ftac Olympus Acquisition Corporation Class B,195891,99.48,Ftac Hera Acquisition A,134243,99.47,Ftac Parnassus Acquisition Units,186654,99.47
"FTD Companies, Inc.",23733,ftd companies,ftd,FTD Group,64982.0,,,LFTD Partners,130456,99.69,FTD.com A (XETRA),306003,99.64,FTD.com 'A',72833,99.58,FTD.com 'A' (Frankfurt),294851,99.58,FTD Com 'B',195894,99.58,FTD 'A',72832,99.5,Softdesk,76968,99.48,FTD Group,64982,99.38,FTD Group (Berlin),301035,99.38,FT Holdings,109683,99.27
FTPYME BANCAJA 3 Fondo de Titulizacion de Acti,8033,ftpyme bancaja 3 fondo de titulizacion de acti,ftpyme,,,,,FT Holdings,109683,99.08,TP Group,127306,99.08,TP Group (Non-NASDAQ OTC),240456,99.08,TP Group (Berlin),275283,99.08,T Bank,22692,99.04,F Investment Trust Group,125685,99.04,Pryme,112944,79.36,Pryme (Frankfurt),273762,79.36,Men Investment Group,2744,79.32000000000001,MEC,111574,79.32000000000001
"Fuji Xerox Co., Ltd.",13495,fuji xerox,fuji,Fuji,26071.0,Fuji (Non-NASDAQ OTC),245656.0,Fuji Oozx,109699,99.74,Fuji Oozx (Non-NASDAQ OTC),236556,99.74,Fuji Seito,26086,99.7,Fuji Latex,109696,99.7,Fuji Seiko,109704,99.7,Fujix,109723,99.67,Fuji Oil Holdings,106537,99.67,Fuji Die,109690,99.67,Fuji Oil,109698,99.67,Fujitec EDR,166965,99.67
"Fujian Fuqing Nuclear Power Co., Ltd.",7205,fujian fuqing nuclear power,fujian,Fujian Holdings,100592.0,Fujian Zhenyun Plastics Industry (Non-NASDAQ OTC),236557.0,Fujian Mindong Electric Power 'A',88651,99.67,Fujian Nuoqi Company Limited Class B,166964,99.64,Fujian Qingshan Paper 'A',88655,99.62,Fujian Funeng 'A',88648,99.59,Fujian Funeng 'A' (SSE Connect Equities),212434,99.59,Fujian Nanping Sun Cable 'A',88653,99.58,Fujian Nanping Sun (SEC) Cable 'A',212437,99.58,Fujian Furi Electronics 'A',92835,99.56,Fujian Yanjing Huiquan Brewery 'A',92850,99.56,Fujian Sunner Development 'A',88659,99.54
