Target Name,Target No.,preprocessed,Focus Text,Shortest Match Name,Shortest Match No.,Non-NASDAQ OTC Match Name,Non-NASDAQ OTC Match No.,Matched Name 1,Matched No. 1,Matched Score 1,Matched Name 2,Matched No. 2,Matched Score 2,Matched Name 3,Matched No. 3,Matched Score 3,Matched Name 4,Matched No. 4,Matched Score 4,Matched Name 5,Matched No. 5,Matched Score 5,Matched Name 6,Matched No. 6,Matched Score 6,Matched Name 7,Matched No. 7,Matched Score 7,Matched Name 8,Matched No. 8,Matched Score 8,Matched Name 9,Matched No. 9,Matched Score 9,Matched Name 10,Matched No. 10,Matched Score 10
Remgro Jersey GBP Limited,12482,remgro jersey gbp,remgro,Remgro,116073.0,Remgro (Non-NASDAQ OTC),239411.0,Remgro ADR 1:1,209242,99.58,Remgro,116073,99.52,Remgro Limited,180436,99.52,Remgro (Non-NASDAQ OTC),239411,99.52,Remgro (Non-NASDAQ OTC),248351,99.52,Remgro (Frankfurt),273949,99.52,Remgro (XETRA),315051,99.52,REM Group (Holdings),103906,99.3,MG,36938,99.21,MG International,94498,99.21
REN Finance B.V.,16349,ren b.v.,ren,Ren (XETRA),315054.0,Ren (Non-NASDAQ OTC),239413.0,Renk V (Munich),170045,99.71,Piren B,43372,99.67,Piren B,180195,99.67,Renova,107081,99.57000000000001,Renova (Stuttgart),281469,99.57000000000001,Renovo Group (XETRA),315065,99.57000000000001,Ameren BDR,148514,99.56,Ren (Non-NASDAQ OTC),239413,99.55,Ren (Frankfurt),273952,99.55,Ren (XETRA),315054,99.55
RENA GmbH,7700,rena gmbh,rena,Rena Karton,38640.0,,,Renard MFG,76453,99.63,Arena PL,107906,99.59,Arena PL (Frankfurt),267909,99.59,Arena,275,99.57000000000001,Arena,91227,99.57000000000001,Arena Group Holdings,135625,99.57000000000001,Renak Holdings,152594,99.57000000000001,Arena (Stuttgart),276730,99.57000000000001,Verena Multi Finance,105643,99.57000000000001,Renato,21526,99.53
RENAULT DO BRASIL S.A.,4399,renault do brasil,renault,Renault,87661.0,Renault (Non-NASDAQ OTC),248354.0,Renault ADR 5:1,190337,99.62,Renault ADR 5:1 (Frankfurt),259193,99.62,Renault ADR 5:1 (XETRA),292319,99.62,Fasa Renault Limited Data,17446,99.59,Renault Investment (United Kingdom),50105,99.58,Renault,87661,99.58,Renault (Mexico),218676,99.58,Renault (Swiss Stock Exchange),225561,99.58,Renault (Ireland),232728,99.58,Renault (Non-NASDAQ OTC),248354,99.58
RENEW AKSHAY URJA LIMITED,11744,renew akshay urja,renew,ERG Renew,17220.0,Renew Holdings (Non-NASDAQ OTC),248358.0,Renewagy,11693,99.56,Renewagy (Frankfurt),281468,99.56,Renewagy (XETRA),315062,99.56,Renewable Japan,113095,99.56,Via Renewables A,138719,99.55,Via Renewables A (Frankfurt),266935,99.55,Renewal Fuels,131636,99.53,Renewable Fuel,131635,99.52,Renew Energy Resources,57145,99.51,Renew Energy Resources (Berlin),302816,99.51
Renoir CDO B.V.,16231,renoir cdo b.v.,renoir,Ginza Renoir,109877.0,,,Ginza Renoir,109877,99.44,Ren (Non-NASDAQ OTC),239413,99.33,Ren (Frankfurt),273952,99.33,Ren (XETRA),315054,99.33,O-Bank,115989,99.12,Prenor Group,11361,90.57000000000001,Rexnord,67752,82.72,Rexnord,199939,82.72,Renovis,76455,82.62,Trencor,123679,82.62
Renova Eolica Participacoes S.A.,4360,renova eolica participacoes,renova,Renova,107081.0,,,Renova Energia PN Receipts,152601,99.64,Renova Energia PN Receipts,152602,99.64,Renova Energia Unit Receipts,152604,99.58,Renova Energia Unit Receipt,152603,99.56,Renova Energia Units,85780,99.55,Renova Energia On,149860,99.55,Renova Energia PN,149861,99.55,Renovacare,131639,99.54,Renovacor Equity Warrants,190341,99.54,Autorenova Paracka,32539,99.53
RenRe North America Holdings Inc.,22845,renre north america,renre,,,,,Renrenle Commercial Group 'A',95329,99.57000000000001,Renren Unlisted,160672,99.53,Renren ADR 1:45,141263,99.53,Renren ADR 1:45 (Frankfurt),273971,99.53,Renren Inc,11696,99.48,Renren,160670,99.48,Renren,160671,99.48,Renren Class A Sponsored (XETRA) ADR 1:3,315066,99.47,Ehrenreich Photo,64439,99.46,Ren (Non-NASDAQ OTC),239413,99.27
Renting Colombia S.A.,7319,renting colombia,renting,,,,,China Parenting Network Holdings,99633,99.46,ENT,1607,99.32,Ren (Non-NASDAQ OTC),239413,99.32,Ren (Frankfurt),273952,99.32,Ren (XETRA),315054,99.32,TI Group,183594,99.22,TI Group,201171,99.22,T Bank,22692,99.12,Tingo,127769,88.59,Perenti Global,85338,85.81
Repsol Europe Finance SARL,15347,repsol europe sarl,repsol,Repsol YPF,87481.0,Repsol YPF (Non-NASDAQ OTC),248368.0,Repsol ADR (London),242752,99.64,Repsol ADR (Frankfurt),259197,99.64,Repsol Acciones,170056,99.61,Repsol YPF,87481,99.57000000000001,Repsol YPF (Mexico),218682,99.57000000000001,Repsol YPF (BRN),225564,99.57000000000001,Repsol YPF (Ireland),232733,99.57000000000001,Repsol YPF (Non-NASDAQ OTC),248368,99.57000000000001,Repsol YPF (Frankfurt),273979,99.57000000000001,Repsol YPF (Milan),273981,99.57000000000001
REPSOL OIL & GAS CANADA INC.,5443,repsol oil & gas canada,repsol,Repsol YPF,87481.0,Repsol YPF (Non-NASDAQ OTC),248368.0,Repsol ADR (London),242752,99.55,Repsol ADR (Frankfurt),259197,99.55,Repsol YPF (Stuttgart) Bonus Rights Code,281480,99.55,Repsol Acciones,170056,99.53,Repsol ADR 1:1,190343,99.49,Repsol ADR 1:1 (XETRA),292320,99.49,Repsol YPF (Non-NASDAQ OTC) Bonus Rights,239426,99.48,Repsol YPF (Frankfurt) Bonus Rights,273980,99.48,Repsol YPF (Frankfurt) Bonus Rights,281476,99.48,Repsol YPF (Frankfurt) Bonus Rights,281477,99.48
"Res-Care, Inc.",20488,res care,res,,,,,Crestacare,46413,99.78,Resources-Care,61139,99.73,Resources-Care (Berlin),288899,99.73,Restar Holdings,113107,99.71,Fresh Market,59972,99.7,Fresh Market (Berlin),286475,99.7,Fresh Market (XETRA),305996,99.7,Restart,95335,99.67,Restore,124818,99.67,Restart (Stuttgart),273989,99.67
RESIDENTIAL SECURE INCOME PLC,9834,residential secure income,residential,Veris Residential,135254.0,Nippon Residential Investment (Non-NASDAQ OTC),75346.0,Residential Resources Mortgage Investment,76470,99.69,Residential Resources Mortgage Investment,199910,99.69,Presidential Life,61040,99.67,Presidential Resorts International,76132,99.67,Presidential Life (Berlin),288664,99.67,American Residential Services,62443,99.67,KCR Residential REIT,126158,99.67,New Residential Investment REIT,134703,99.67,New Residential (Frankfurt) Investment REIT,264928,99.67,Mill Residential REIT,49035,99.65
RESIDEO FUNDING INC.,24746,resideo funding,resideo,Resideo Technologies,134938.0,,,Resideo Technologies,134938,99.57000000000001,Resideo (Mexico) Technologies,218684,99.57000000000001,Resideo (Pet) Technologies,252269,99.57000000000001,Resideo (Frankfurt) Technologies,265767,99.57000000000001,Resideo (XETRA) Technologies,265768,99.57000000000001,ESI,92595,99.33,ESI Group,92596,99.33,IDE Group Holdings,126052,99.33,ESI Group (Non-NASDAQ OTC),245379,99.33,ESI Group (Frankfurt),269982,99.33
"RESIDOMO, s.r.o.",7412,residomo s.r.o.,residomo,,,,,Idom,110379,99.42,Dom Security,16643,99.33,Dom,33949,99.33,Dom Holdings,46646,99.33,IDO Security,55149,99.33,ESI,92595,99.33,ESI Group,92596,99.33,ESI Group (Non-NASDAQ OTC),245379,99.33,ESI Group (Frankfurt),269982,99.33,IDO Security (Berlin),287038,99.33
RESILIENCE RE LTD.,3924,resilience re,resilience,,,,,ESI,92595,99.38,ESI Group,92596,99.38,ESI Group (Non-NASDAQ OTC),245379,99.38,ESI Group (Frankfurt),269982,99.38,SI International,76840,99.27,CE Holdings,108530,99.27,NC Holdings,112050,99.27,SI Holdings,113637,99.27,ES Group (Holdings),118639,99.27,SI International (Frankfurt),297061,99.27
"Resona Bank, Limited.",13500,resona limited.,resona,Resona Holdings,106238.0,Resona Holdings (Non-NASDAQ OTC),248372.0,Resonate,76474,99.7,Resonate (Frankfurt),296782,99.7,Resonate Blends,131648,99.67,Resonant,61142,99.61,Resonant (Frankfurt),281488,99.61,Resonance Specialities,103919,99.59,Resonance Health,85794,99.58,Resonance Health (Berlin),288904,99.58,Resona Holdings,106238,99.57000000000001,Resona Holdings (BRN),228541,99.57000000000001
Resona Preferred Global Securities (Cayman) Li,14768,resona preferred global li,resona,Resona Holdings,106238.0,Resona Holdings (Non-NASDAQ OTC),248372.0,Resona Trust and Banking Company Limited,29651,99.55,Resonance Specialities,103919,99.5,Resonate Blends,131648,99.49,Resonance Health,85794,99.48,Resonance Health (Berlin),288904,99.48,Jacobson Resonance Enterprises,73995,99.43,Resonate,76474,99.41,Resonate (Frankfurt),296782,99.41,Resona Holdings,106238,99.38,Resona Holdings (BRN),228541,99.38
RESORTS WORLD LAS VEGAS LLC,24822,resorts world las vegas,resorts,Thunderbird Resorts,191313.0,Crown Resorts (Non-NASDAQ OTC),244897.0,WHG Resorts and Casinos,69330,99.57000000000001,Resorts International A,67730,99.56,Flex Resorts and Real Estate,26011,99.55,Red Rock Resorts Class A,134922,99.55,Red Rock Resorts (Frankfurt) Class A,265725,99.55,Leisure and Resorts World,111268,99.54,Leisure and Resorts World 'B',179504,99.54,Laguna Resorts and Hotels NVDR,175643,99.53,APEX Resorts Rights,5158,99.52,Andalusian Resorts and Spas,52277,99.52
RESOURCE CAPITAL TRUST II,20923,resource capital ii,resource,Vanadiumcorp Resource,86899.0,Minterra Resource (Non-NASDAQ OTC),56062.0,Resource Capital Group Incorporated,67731,99.91,Resource Capital (XETRA),308089,99.91,Resource Capital Gold (Non-NASDAQ OTC),131649,99.85,Resource Capital Gold,216026,99.85,Resource Capital (Frankfurt) Gold,281491,99.85,Olive Resource Capital,85119,99.78,Olive Resource (Non-NASDAQ OTC) Capital,247746,99.78,Olive Resource (Frankfurt) Capital,265140,99.78,Ocean Resources Capital Holdings,49438,99.76,Ocean Resources Capital Holdings (Berlin),302379,99.76
RESPARCS FUNDING II LIMITED PARTNERSHIP,12402,resparcs funding ii partnership,resparcs,,,,,Arcs,106318,99.23,Spar Group,115285,99.23,Spar Group,138354,99.23,Spar Group (Non-NASDAQ OTC),248955,99.23,Spar Group (Berlin),266211,99.23,Spar Group (Berlin),274690,99.23,Arc Group,52363,99.18,Arc International (Non-NASDAQ OTC),52364,99.18,RCS Holdings,76381,99.18,Spa International,77051,99.18
