Target Name,Target No.,Top Match Name,Top Match No.,Top Match Score,All Matched
RHB Bank Berhad,15814,RHB Bank Berhad,3558,100,"[('RHB Bank Berhad', 100), ('Security Bank', 90), ('Security Bank', 90), ('Security Bank', 90), ('Security Bank', 90), ('Security Bank', 90), ('Security Bank', 90), ('Security Bank', 90), (': be AG', 90), ('RH', 90)]"
Segari Energy Ventures Sdn. Bhd.,15815,Security Energy,123539,90,"[('Security Energy', 90), ('Security Energy', 90), ('Sega', 90), ('Security Energy', 90), ('Enphase Energy', 86), ('Siemens Energy N', 86), ('China Southern Power Grid Energy Efficiency and Clean Energy A', 86), ('Fuelcell Energy', 86), ('O y Nofar Energy', 86), (""Risen Energy 'A'"", 86)]"
YTL Power Generation Sdn Bhd,15816,Gener,16576,90,"[('Gener', 90), ('Capital Power', 90), ('Capital Power', 90), ('Generation Capital', 90), ('Genera', 90), ('Capital Power', 90), ('Nera', 90), ('Power Generation', 90), ('Capital Power', 90), ('Plug Power', 86)]"
RHB Investment Bank Berhad,15817,CIMB Investment Bank Berhad,29494,91,"[('CIMB Investment Bank Berhad', 91), ('Security Bank', 90), ('Security Bank', 90), ('Security Bank', 90), ('Security Bank', 90), ('Security Bank', 90), ('Security Bank', 90), ('Security Bank', 90), ('T Bank', 90), ('Security Investment Bank', 90)]"
KHAZANAH NASIONAL BERHAD,15818,Ion,120567,90,"[('Ion', 90), ('ASI', 90), ('ONA', 90), ('Ion', 90), ('RHB Bank Berhad', 86), ('Spritzer Berhad', 86), ('Zelan Berhad', 86), ('Tenaga Nasional', 86), ('Be - be', 86), ('R R Securities', 86)]"
AmBank (M) Berhad,15819,Mbank,3798,90,"[('Mbank', 90), ('Security Bank', 90), ('Security Bank', 90), ('Security Bank', 90), ('Security Bank', 90), ('Security Bank', 90), ('Security Bank', 90), ('Security Bank', 90), ('AMB', 90), ('Security Bank', 90)]"
TNB Capital (Labuan) Limited,15820,T&N,46057,86,"[('T&N', 86), ('T&N', 86), ('T&N', 86), ('T T', 86), ('Gaban', 72), ('Buyan', 72), ('T Bank', 71), ('Security Bank', 68), ('Security Bank', 68), ('Security Bank', 68)]"
WESTPORTS MALAYSIA SDN. BHD.,15821,Port,98092,90,"[('Port', 90), ('West', 90), ('West', 90), ('Malaysia Capital', 90), ('West', 90), ('Heineken Malaysia', 86), ('Nylex (Malaysia)', 86), ('Bursa Malaysia', 86), ('Gadek (Malaysia)', 86), ('Hwang Capital (Malaysia)', 86)]"
EON Bank Berhad,15822,Security Bank,136665,90,"[('Security Bank', 90), ('Security Bank', 90), ('Security Bank', 90), ('Security Bank', 90), ('Security Bank', 90), ('EON Capital', 90), ('Security Bank', 90), ('Security Bank', 90), (': be AG', 90), ('RH', 90)]"
New Pantai Expressway Sdn Bhd,15824,Press Corporation,220658,90,"[('Press Corporation', 90), ('Express', 90), ('Anta', 90), ('Press Corporation', 90), ('Triumph Group New', 86), ('New Energy Exchange', 86), ('New NRG', 86), ('ATD New Holdings', 86), ('GKN (New Europe)', 86), ('New Bridge Products', 86)]"
HSBC Bank Malaysia Behard,15826,Security Bank,136665,90,"[('Security Bank', 90), ('Security Bank', 90), ('Security Bank', 90), ('Security Bank', 90), ('Security Bank', 90), ('Security Bank', 90), ('Security Bank', 90), ('Malaysia Capital', 90), ('Security Bank', 90), ('Select Bank', 86)]"
IOI Investment (L) Berhad,15827,Investment Trust Corporation,129028,90,"[('Investment Trust Corporation', 90), ('Investment Trust Corporation', 90), ('Trust Invest', 90), ('Investment Trust Corporation', 90), ('B C L Forgings', 86), ('RHB Bank Berhad', 86), ('Bank for Investment and Development of Vietnam', 86), ('Asia Al Iraq Isbk for Investment and Finance', 86), ('Al Taif Isbk for Investment and Finance', 86), ('Mousil Bank for Development and Investment', 86)]"
Kapar Energy Ventures Sdn Bhd,15828,Security Energy,123539,90,"[('Security Energy', 90), ('Security Energy', 90), ('Security Energy', 90), ('Enphase Energy', 86), ('Siemens Energy N', 86), ('China Southern Power Grid Energy Efficiency and Clean Energy A', 86), ('Fuelcell Energy', 86), ('O y Nofar Energy', 86), (""Risen Energy 'A'"", 86), ('Suzlon Energy', 86)]"
Prime Holdings (Labuan) Limited,15829,Prime Capital Corporation,144059,90,"[('Prime Capital Corporation', 90), ('Holdings', 90), ('Holdings', 90), ('Prime Capital Corporation', 90), ('Holdings', 90), ('Prim', 90), ('Holdings', 90), ('Rim', 90), ('LDI Corporation', 90), ('Prime Capital Corporation', 90)]"
OSKIB SDN. BHD.,15830,SDN,928,90,"[('SDN', 90), ('BH', 90), ('SK', 90), ('HD', 90), ('OS', 90), ('SK', 90), ('D&D', 86), ('Amanahraya-REIT Managers SDN Berhad REIT Units', 86), ('Aoki', 68), ('Icbs', 68)]"
Standard Chartered Bank Malaysia Berhad,15831,Standard Chartered,3419,90,"[('Standard Chartered', 90), ('Standard Chartered Bank', 90), ('Chartered Bank', 90), ('Standard Chartered Bank', 90), ('Standard Trust', 90), ('Andar', 90), ('Standa', 90), ('Standard Trust', 90), ('Standard Trust', 90), ('Standard Trust', 90)]"
BANK ISLAM MALAYSIA BERHAD,15832,Bank Islam Malaysia,3514,95,"[('Bank Islam Malaysia', 95), ('Security Bank', 90), ('Security Bank', 90), ('Security Bank', 90), ('Security Bank', 90), ('Security Bank', 90), ('Security Bank', 90), ('Security Bank', 90), ('Malaysia Capital', 90), ('Security Bank', 90)]"
Tanjung Bin Power Sdn. Bhd.,15833,Capital Power,132419,90,"[('Capital Power', 90), ('Capital Power', 90), ('Capital Power', 90), ('Capital Power', 90), ('Plug Power', 86), ('Ballard Power Systems (Nasdaq Non-National)', 86), ('China Southern Power Grid Energy Efficiency and Clean Energy A', 86), ('ITM Power', 86), (""Jiangsu Haili Wind Power Equipment Technology 'A'"", 86), ('Solid Power A', 86)]"
Petronas Chemicals Derivatives Sdn Bhd,15834,Petronas Chemicals Group,10687,86,"[('Petronas Chemicals Group', 86), (""ABA Chemicals 'A'"", 86), ('Alkyl Amines Chemicals', 86), ('Ducgiang Chemicals Group', 86), (""Hubei Xingfa Chemicals 'A'"", 86), ('KMG Chemicals', 86), ('Mitsui Chemicals', 86), ('Tata Chemicals', 86), ('Bodal Chemicals', 86), ('Caprolactam Chemicals', 86)]"
Petronas Chemicals Glycols Sdn Bhd,15835,ABA Chemicals 'A',10718,86,"[(""ABA Chemicals 'A'"", 86), ('Alkyl Amines Chemicals', 86), ('KMG Chemicals', 86), ('Mitsui Chemicals', 86), ('Tata Chemicals', 86), ('Bodal Chemicals', 86), ('Caprolactam Chemicals', 86), ('CHD Chemicals', 86), ('Chembond Chemicals', 86), ('Crown Asia Chemicals', 86)]"
Tanjung Bin Power Sdn. Bhd.,15836,Capital Power,132419,90,"[('Capital Power', 90), ('Capital Power', 90), ('Capital Power', 90), ('Capital Power', 90), ('Plug Power', 86), ('Ballard Power Systems (Nasdaq Non-National)', 86), ('China Southern Power Grid Energy Efficiency and Clean Energy A', 86), ('ITM Power', 86), (""Jiangsu Haili Wind Power Equipment Technology 'A'"", 86), ('Solid Power A', 86)]"
IOI Ventures (L) Berhad,15837,IOI Corporation,37891,90,"[('IOI Corporation', 90), ('ENT', 90), ('Surana Ventures', 86), ('Avatar Ventures', 86), ('B C L Forgings', 86), ('RHB Bank Berhad', 86), ('Century Properties Fund Units L P XVI', 86), (""Credit de l'Est"", 86), ('ES&L Bancorp', 86), ('First Federal S&L Association San Bernard', 86)]"
BANK MUAMALAT MALAYSIA BERHAD,15838,Security Bank,136665,90,"[('Security Bank', 90), ('Security Bank', 90), ('Security Bank', 90), ('Security Bank', 90), ('Security Bank', 90), ('Security Bank', 90), ('Security Bank', 90), ('Amal', 90), ('Malaysia Capital', 90), ('Amal', 90)]"
SPECIAL POWER VEHICLE BERHAD,15839,Ecia,2672,90,"[('Ecia', 90), ('Capital Power', 90), ('Capital Power', 90), ('Special Power', 90), ('Special', 90), ('Capital Power', 90), ('Capital Power', 90), ('Plug Power', 86), ('Ballard Power Systems (Nasdaq Non-National)', 86), ('China Southern Power Grid Energy Efficiency and Clean Energy A', 86)]"
Toyota Capital Malaysia Sdn Berhad,15840,Toyo Securities,27515,90,"[('Toyo Securities', 90), ('Malaysia Capital', 90), ('Toyota Motor', 86), ('Toyota Industries', 86), ('Toyota Boshoku', 86), ('Toyota Caetano', 86), ('RHB Bank Berhad', 86), ('Heineken Malaysia', 86), ('Spritzer Berhad', 86), ('Greenyield Berhad', 86)]"
Bayu Padu Sdn Bhd,15841,SDN,928,90,"[('SDN', 90), ('Bay Capital', 90), ('D&D', 86), ('Amanahraya-REIT Managers SDN Berhad REIT Units', 86), ('Bayu Buana', 86), ('SNI-B', 72), ('Cadus', 72), ('Aldus', 72), ('Paru', 68), ('EBay', 68)]"
KONSORTIUM LEBUHRAYA UTARA-TIMUR (KL) SDN. BHD,15842,Konsortium,25957,90,"[('Konsortium', 90), ('KL Energy', 86), ('Projek Lebuhraya', 86), ('KL Acquisition A', 86), ('Konsortium (XETRA)', 86), ('Malaysia Steel Works (KL)', 86), ('EA Technique (M) SDN', 86), ('Guna Timur Raya', 86), ('KL Infrastructure Group', 86), ('Konsortium Logistik', 86)]"
ANTARA STEEL MILLS SDN. BHD.,15843,Steel,60693,90,"[('Steel', 90), ('Anta', 90), ('Steel Mills', 90), ('Mills', 90), ('Samwon Steel', 86), ('Thai Steel Cable', 86), ('Hindoostan Mills', 86), ('Taiwan Steel Union', 86), ('Hwan Young Steel', 86), ('Tree Island Steel', 86)]"
SBB Capital Corporation,15844,SBBS Consortium Berhad,17673,90,"[('SBBS Consortium Berhad', 90), ('Saab B', 67), ('BBK', 67), ('LSB', 67), ('SYB', 67), ('BPB', 67), ('ABB AG', 67), ('BLB', 67), ('MBB', 67), ('B2B Trust', 67)]"
ORIX Leasing Malaysia Berhad,15845,Orix,23348,90,"[('Orix', 90), ('Capital Leasing', 90), ('Capital Leasing', 90), ('Malaysia Capital', 90), ('Aviaam Leasing', 86), ('Finance Leasing', 86), ('RHB Bank Berhad', 86), ('Bisa Leasing', 86), ('SMB Leasing', 86), ('Heineken Malaysia', 86)]"
AMBB Capital (L) Ltd,15846,MB Securities,26184,90,"[('MB Securities', 90), ('MBB', 90), ('AMB', 90), ('Capital M', 90), ('AM', 90), ('Capital A', 90), ('L G Balakrisnan and Brothers', 86), ('B C L Forgings', 86), ('Bi POC et L Industrie de Cdiv SA', 86), ('Michigan Community Bancorp L', 86)]"
RANTAU ABANG CAPITAL BERHAD,15847,Tau Capital,42463,90,"[('Tau Capital', 90), ('Anta', 90), ('ANT', 90), ('Zelan Berhad', 86), ('Be - be', 86), ('R R Securities', 86), ('MBF Capital Berhad', 86), ('Leong Hup International Berhad', 86), ('Nissan Industrial Oxygen Incorporated Berhad', 86), ('Wembley Industries Holdings Berhad', 86)]"
Hong Leong Assurance Berhad,15849,Hong Leong Capital,25610,90,"[('Hong Leong Capital', 90), ('Security Assurance', 90), (""Suzhou Jin Hong Shun Auto Participations 'A'"", 86), ('Hong Leong Bank', 86), ('RHB Bank Berhad', 86), ('Spritzer Berhad', 86), ('Greenyield Berhad', 86), ('Hong Leong Asia', 86), ('Hong Phong Cement', 86), ('Zelan Berhad', 86)]"
United Overseas Bank (Malaysia) Bhd,15850,United Overseas Bank,137557,90,"[('United Overseas Bank', 90), ('Unite Capital', 90), ('United', 90), ('United', 90), ('United', 90), ('Malaysia Capital', 90), ('United Overseas Bank', 90), ('United Overseas Bank', 90), ('United Aircraft Corporation', 86), ('United Industrial', 86)]"
OCBC Bank (Malaysia) Berhad,15851,Security Bank,136665,90,"[('Security Bank', 90), ('Security Bank', 90), ('Security Bank', 90), ('Security Bank', 90), ('Security Bank', 90), ('Security Bank', 90), ('Security Bank', 90), ('Malaysia Capital', 90), ('Security Bank', 90), ('Select Bank', 86)]"
RHB ISLAMIC BANK BERHAD,15852,Security Bank,136665,90,"[('Security Bank', 90), ('Security Bank', 90), ('Security Bank', 90), ('Security Bank', 90), ('Security Bank', 90), ('Security Bank', 90), ('Security Bank', 90), ('B I Incorporated', 90), ('AMI', 90), ('Security Bank', 90)]"
AmIslamic Bank Berhad,15853,Security Bank,136665,90,"[('Security Bank', 90), ('Security Bank', 90), ('Security Bank', 90), ('Security Bank', 90), ('Security Bank', 90), ('Security Bank', 90), ('Security Bank', 90), ('AMI', 90), ('MIS', 90), ('Security Bank', 90)]"
HONG LEONG INVESTMENT BANK BERHAD.,15855,Hong Leong Bank Berhad 'A',134448,91,"[(""Hong Leong Bank Berhad 'A'"", 91), ('T Bank', 90), ('Security Investment Bank', 90), ('Hong Leong Capital', 90), ('Security Investment Bank', 90), ('Investment Trust Corporation', 90), ('Investment Trust Corporation', 90), ('Trust Invest', 90), ('Investment Trust Corporation', 90), ('Select Bank', 86)]"
Malakoff Corporation Berhad,15856,: be AG,13926,90,"[(': be AG', 90), ('Malakoff', 90), ('Malakoff', 90), ('RH', 90), ('Be', 90), ('ALA', 90), ('Melati Ehsan Holdings Berhad', 86), ('Putrajaya Perdana Berhad', 86), ('Be - be', 86), ('R R Securities', 86)]"
YTL Corp Finance (Labuan) Limited,15857,YTL Corporation,43781,90,"[('YTL Corporation', 90), ('INA', 90), ('L&F', 90), ('Geo Finance', 86), ('The Housing Bank for Trade and Finance', 86), ('Asia Al Iraq Isbk for Investment and Finance', 86), ('Al Taif Isbk for Investment and Finance', 86), ('Canterbury SRY Hills Community Finance', 86), ('Erbil Bank for Investment and Finance', 86), ('Ipdc Finance', 86)]"
GANDALF CAPITAL SDN. BHD.,15858,SDN,928,90,"[('SDN', 90), ('BH', 90), ('GA Capital', 90), ('HD', 90), ('Andal', 90), ('Gandalf', 90), ('Gan', 90), ('Gan', 90), ('Da Securities', 90), ('Gan', 90)]"
Tesco Stores (Malaysia) Sdn Bhd.,15859,Tesco,244478,90,"[('Tesco', 90), ('Tesco', 90), ('Tesco', 90), ('Store Capital', 90), ('Malaysia Capital', 90), ('Tesco', 90), ('Limited Stores', 90), ('Tesco', 90), ('Tesco', 90), ('Tesco American', 86)]"
PENANG PORT SDN. BHD.,15860,SDN,928,90,"[('SDN', 90), ('Port', 90), ('T&S', 90), ('Bay Port State Bank Bay Port Michigan', 86), ('Port Final', 86), ('R R Securities', 86), (""Delaware Group Fundtn Funds Balanced Port 'I'"", 86), ('Victory Fund New York Municipal Port', 86), ('Port Saied Agri Develop Consolidated', 86), ('D&D', 86)]"
Hijrah Pertama Berhad,15861,AMA,127203,90,"[('AMA', 90), ('AMA', 90), ('Zelan Berhad', 86), ('Be - be', 86), ('R R Securities', 86), ('MBF Capital Berhad', 86), ('Wembley Industries Holdings Berhad', 86), ('Smile Link Healthcare Global Berhad', 86), ('Jaycorp Berhad', 86), ('D&D', 86)]"
INVERFIN SDN BHD,15862,SDN,928,90,"[('SDN', 90), ('BH', 90), ('INV', 90), ('HD', 90), ('NVE', 90), ('R R Securities', 86), ('D&D', 86), ('I D I', 86), ('F&F', 86), ('Amanahraya-REIT Managers SDN Berhad REIT Units', 86)]"
PAC LEASE BERHAD,15863,: be AG,13926,90,"[(': be AG', 90), ('RH', 90), ('Be', 90), ('PA', 90), ('Melati Ehsan Holdings Berhad', 86), ('Putrajaya Perdana Berhad', 86), ('Be - be', 86), ('Best Lease', 86), ('First Lease International', 86), ('Lease IT', 86)]"
