Target Name,Target No.,Top Match Name,Top Match No.,Top Match Score,All Matched
THE FIRST CAPITAL BANK OF KENTUCKY,22331,Security Bank,136665,90,"[('Security Bank', 90), ('Security Bank', 90), ('Security First Bank', 90), ('First Capital Corporation', 90), ('Security Bank', 90), ('Bank of Kentucky', 90), ('Security Bank', 90), ('Security Bank', 90), ('First Capital Corporation', 90), ('Security Bank', 90)]"
Huntington Capital III,22332,Hunt,43354,90,"[('Hunt', 90), ('Hunting', 90), ('Huntington Ingalls Industries', 86), ('Huntington Bancshares', 86), ('CFB Capital III', 86), ('Corts Trust III First Union Institutional Capital 7.5%', 86), ('Corts Trust III IBM Debs 7.2%', 86), ('Corts Trust III Safeco Capital Trust I 8.072%', 86), ('Corts Trust III Sherwin Williams Class A 7.25%', 86), ('Excelsior Venture Partners III LLC', 86)]"
Northgroup Preferred Capital Corporation,22333,North,74287,90,"[('North', 90), ('Securities Group', 90), ('Securities Group', 90), ('North', 90), ('Securities Group', 90), ('Ford Motor Company Capital Trust Trust Originated Preferred Securities 9%', 86), ('Olympic Financial Convertible Preferred Shares', 86), ('BTR Nylex Convertible Preferred', 86), ('Hercules Trust I Trust Originated Preferred Securities', 86), ('Consumers Energy Fininvest Gestione Fondi II Trust Originated Preferred Securities 8.20%', 86)]"
Wells Fargo Bank South Central National Associ,22335,O-Bank,4902,90,"[('O-Bank', 90), ('Bank South', 90), ('National', 90), ('Central Trust', 90), ('National', 90), ('National', 90), ('Central Trust', 90), ('Central Trust', 90), ('National', 90), ('National', 90)]"
Noranda Aluminum Acquisition Corp.,22336,Norand,22339,90,"[('Norand', 90), ('Ibks Smart SME Special Purpose Acquisition Number 1', 86), ('Parkway Acquisition', 86), ('Aldabra Acquisition', 86), ('International Aluminum', 86), ('Proguard Acquisition', 86), ('SCNV Acquisition', 86), ('Ares Acquisition A', 86), ('26 Capital Acquisition A', 86), ('5 01 Acquisition A', 86)]"
"Polar Tankers, Inc.",22337,AR,5551,90,"[('AR', 90), ('Tanke', 90), ('Polar', 90), ('NK', 90), ('RS', 90), ('Ta', 90), ('Polar', 90), ('Anker', 90), ('Polar On', 86), ('Polar Molecular Holding', 86)]"
Farmers and Mechanics Bank,22338,Farmers and Mechanics Bank Connecticut,6843,95,"[('Farmers and Mechanics Bank Connecticut', 95), ('Security Bank', 90), ('Security Bank', 90), ('Security Bank', 90), ('Security Bank', 90), ('Security Bank', 90), ('Security Bank', 90), ('Security Bank', 90), ('Chanic', 90), ('Security Bank', 90)]"
Regions Financing Trust II,22339,Ion,120567,90,"[('Ion', 90), ('S&F Capital', 90), ('CIN', 90), ('Regio Capital', 90), ('Financing', 90), ('INA', 90), ('Ion', 90), ('NCI Inc', 90), ('Allegiant Capital Trust II', 86), ('American Affordable Housing II Limited Partnership', 86)]"
Allegheny Ludlum Corporation,22340,DL,13790,90,"[('DL', 90), ('All Corporation', 90), ('Allegheny Valley Bancorp', 86), ('D&D', 86), ('Allegheny West RY Cap 6 Guaranteed', 86), ('Allegheny and Western Energy', 86), ('Allegheny International Preferred $11.25', 86), ('Allegheny International Preferred $2.19', 86), ('Allegheny Technologies (Frankfurt)', 86), ('Allegheny Technologies (XETRA)', 86)]"
"ALTA MESA HOLDINGS, LP",22341,Holdings,169490,90,"[('Holdings', 90), ('Holdings', 90), ('Alta', 90), ('Alta', 90), ('Holdings', 90), ('Holdings', 90), ('Mesa', 90), ('LDI Corporation', 90), ('Corporation Holding', 90), ('Holdings', 90)]"
State Street Capital Trust IV,22342,State Street,23343,95,"[('State Street', 95), ('Tre', 90), ('Stat', 90), ('At Trust', 90), ('Capital Re', 90), ('Capital Re', 90), ('Treet Corporation', 90), ('Ta', 90), ('State Street (MIC)', 88), ('State Street DS', 87)]"
CBG Florida REIT Corp.,22343,Florida Capital,37350,90,"[('Florida Capital', 90), ('Flo', 90), ('First Florida Banks Merger 21/12/92', 86), ('American Savings Florida Federal Savings Bank', 86), ('Chase Federal Savings Bank Miami Florida', 86), ('First National Bankshares of Florida', 86), ('Florida First Federal Savings Bank', 86), ('Florida Banks', 86), ('Friends Bank New Smyrna Beach Florida CDT', 86), ('Peoples Saint Bank Groveland Florida', 86)]"
Goldman Sachs Capital Trust III,22344,ACH,28016,90,"[('ACH', 90), ('Man AG', 90), ('Man AG', 90), ('Capital Gold', 90), ('Sachs AG', 90), ('Man AG', 90), ('CFB Capital III', 86), (""Corts Trust Goldman Sachs Capital I 6% 'A'"", 86), ('Corts Trust II Goldman Sachs Corporate Backed Trust Securities Class A Certificate', 86), ('Corts Trust III First Union Institutional Capital 7.5%', 86)]"
BAC CAPITAL TRUST XV,22345,Capital A,111270,90,"[('Capital A', 90), ('X', 90), ('BAC Ha Hydropower', 86), ('BAC Minh Development Investment', 86), ('BAC Holding Internation', 86), ('BAC A Commercial', 86), ('BAC Holding International Dummy', 86), ('Ha BAC Hung Phat Chemical', 86), ('BAC NA JSC', 86), (""Public Storage Properties XV 'A'"", 86)]"
EverBank,22346,Security Bank,136665,90,"[('Security Bank', 90), ('Security Bank', 90), ('Security Bank', 90), ('Security Bank', 90), ('Security Bank', 90), ('Security Bank', 90), ('Security Bank', 90), ('Everbank Financial', 90), ('NK', 90), ('Ever', 90)]"
Pinnacle Bank,22347,Pinnacle Bank CA,4981,95,"[('Pinnacle Bank CA', 95), ('Security Bank', 90), ('Security Bank', 90), ('Pinnacle Bank of Oregon', 90), ('Security Bank', 90), ('Security Bank', 90), ('Security Bank', 90), ('Security Bank', 90), ('Security Bank', 90), ('NK', 90)]"
The Bank of Vernon,22348,Security Bank,136665,90,"[('Security Bank', 90), ('Security Bank', 90), ('Security Bank', 90), ('Security Bank', 90), ('Security Bank', 90), ('Security Bank', 90), ('Security Bank', 90), ('Security Bank', 90), ('Aerospace Technology of Korea', 86), ('Protective Products of America (Non-NASDAQ OTC)', 86)]"
Republic Bank & Trust Company,22349,Public Bank,3447,90,"[('Public Bank', 90), ('Security Bank', 90), ('Security Bank', 90), ('Republic Bank', 90), ('Security Bank', 90), ('Security Bank', 90), ('Security Bank', 90), ('Security Bank', 90), ('Security Bank', 90), ('REP', 90)]"
Deutsche Bank Contingent Capital Trust II,22350,Deutsche Bank,133291,90,"[('Deutsche Bank', 90), ('Security Bank', 90), ('Security Bank', 90), ('Security Bank', 90), ('Security Bank', 90), ('Security Bank', 90), ('Security Bank', 90), ('Security Bank', 90), ('Deutsche Capital', 90), ('Deutsche Bank', 90)]"
Bank Mutual,22351,Bank Mutual,5725,100,"[('Bank Mutual', 100), ('Mutual Trust Bank', 95), ('Security Bank', 90), ('Security Bank', 90), ('Security Bank', 90), ('Security Bank', 90), ('Security Bank', 90), ('Security Bank', 90), ('Security Bank', 90), ('Mutual', 90)]"
"Energy XXI Gulf Coast, Inc.",22352,Energy XXI Gulf Coast,78671,100,"[('Energy XXI Gulf Coast', 100), ('ERG', 90), ('Security Energy', 90), ('ERG', 90), ('Security Energy', 90), ('Energy XXI', 90), ('Gulf', 90), ('ERG', 90), ('Security Energy', 90), ('Enphase Energy', 86)]"
HSBC USA Inc,22353,HSBC USA,134480,100,"[('HSBC USA', 100), ('Capital A', 90), (""HSBC USA Depositary Shares 1/40 Preferred 'H'"", 90), (""HSBC USA Preferred 'D' Deposit 1/4 Shares"", 90), ('HSBC USA Preferred £1 8125', 90), ('HSBC USA Preferred £28575', 90), ('HSBC USA Sustainable Equity Ucits ETF US Dollar', 90), ('HSBC USA Sustainable Equity (London) Ucits ETF US Dollar', 90), ('HSBC USA Sustainable Equity (Mexico) Ucits ETF US Dollar', 90), ('HSBC USA Sustainable Equity (Milan) Ucits ETF US Dollar', 90)]"
"GREAT-WEST LIFE & ANNUITY INSURANCE CAPITAL, L",22355,HLB Life Science,627,86,"[('HLB Life Science', 86), ('North-West Electric', 86), ('Great Wall Builders', 86), ('Skye Life Ventures', 86), ('Great Britain Auto', 86), ('Ironrock Insurance', 86), ('B C L Forgings', 86), ('GLG Life Technology', 86), ('Golden West Home', 86), ('Great Western Systems', 86)]"
"Piedmont Operating Partnership, L.P.",22356,Capital Partners,24473,90,"[('Capital Partners', 90), ('Artner', 90), ('Opera Limited', 90), ('Limco-Piedmont', 86), ('Enex 88-89 Income and Retirement Unit Limited Partnership Int 4', 86), ('Borden Chemicals and Plastics Limited Partnership Units', 86), ('Boston Capital Tax Credit Fund Limited Partnership Units II Series 12', 86), ('Boston Financial Qualified Housing Textorial CR Unit Limited Partnership II', 86), ('Boston Financial Tax Credit Plus Units Limited Partnership A', 86), ('Capital Growth Mortgage Investments Limited Partnership Depositary Unit', 86)]"
Deutsche Postbank Funding Trust IV,22359,Security Bank,136665,90,"[('Security Bank', 90), ('Security Bank', 90), ('Security Bank', 90), ('Security Bank', 90), ('Security Bank', 90), ('Deutsche Postbank AG', 90), ('Postbank', 90), ('Security Bank', 90), ('Security Bank', 90), ('Deutsche Capital', 90)]"
NorthStar Realty Finance Limited Partnership,22360,North,74287,90,"[('North', 90), ('Capital Partners', 90), ('North', 90), ('Northstar Realty Finance', 90), ('Finance Leasing', 86), ('Geo Finance', 86), ('Enex 88-89 Income and Retirement Unit Limited Partnership Int 4', 86), ('Kuwait Finance House', 86), ('GPO Finance Banorte', 86), ('AU Small Finance Bank', 86)]"
"BRIDGESTONE AMERICAS, INC.",22361,Bridgestone,1354,90,"[('Bridgestone', 90), ('Bridge Securities', 90), ('Capital One', 90), ('Capital One', 90), ('E&A', 90), ('STO', 90), ('AME', 90), ('ICA AB', 90), ('ICA AB', 90), ('ICA AB', 90)]"
"BP AMI Leasing, Inc.",22363,ASI,20784,90,"[('ASI', 90), ('Capital Leasing', 90), ('AMI', 90), ('BP', 90), ('AM', 90), ('Capital Leasing', 90), ('China Aircraft Leasing Group Holdings', 86), ('California First Leasing', 86), ('People S Leasing and Financial Services', 86), ('Premier Leasing and Finance', 86)]"
"Windstream Holdings of the Midwest, Inc.",22364,Holdings,169490,90,"[('Holdings', 90), ('Holdings', 90), ('Windstream Holdings', 90), ('Stream', 90), ('Holdings', 90), ('Holdings', 90), ('Corporation Holding', 90), ('Holdings', 90), ('Midwest', 90), ('Rolls-Royce Holdings', 86)]"
"CHS/Community Health Systems, Inc.",22365,Community Health Systems,50752,95,"[('Community Health Systems', 95), ('Community Health Systems', 95), ('Stem', 90), ('Community Capital', 90), ('Health', 90), ('Unit', 90), ('Unity Health', 90), ('Unit', 90), ('PLC Systems', 90), ('Health', 90)]"
Hypo Real Estate International Trust I,22366,International Real Estate,92964,95,"[('International Real Estate', 95), ('National', 90), ('Terna', 90), ('Stat', 90), ('Tern', 90), ('Inter', 90), ('National', 90), ('National', 90), ('Tern', 90), ('Real Security', 90)]"
Citigroup Capital XVIII,22368,Citigroup,29510,90,"[('Citigroup', 90), ('Citigroup', 90), ('Securities Group', 90), ('Securities Group', 90), ('Igroup', 90), ('IT', 90), ('Up', 90), ('ITI', 90), ('ITI', 90), ('CIT', 90)]"
MP ENVIRONMENTAL FUNDING LLC,22371,IRO,58092,90,"[('IRO', 90), ('ENT', 90), ('L&F', 90), ('Security Environmental', 90), ('Babcock and Brown Environmental Investments', 86), (""Corts Trust Bellsouth Capital Funding 'D' Corts 7.12%"", 86), (""Beijing Sanju Environmental Protection and NMTS 'A'"", 86), (""Anhuiyuanchen Environmental Protection S&T 'A'"", 86), ('Denox Environmental and Technology Holdings', 86), ('Environmental Infrastructure Holdings', 86)]"
"Performance Food Group, Inc.",22372,Performance Food Group,37542,100,"[('Performance Food Group', 100), ('Performance Food Group', 100), ('Performance Food (BRN) Group', 95), ('Performance Food (Pet) Group', 95), ('Performance Food (Berlin) Group', 95), ('Securities Group', 90), ('Securities Group', 90), ('Forma', 90), ('Man AG', 90), ('Man AG', 90)]"
People's United Bank,22373,Security Bank,136665,90,"[('Security Bank', 90), ('Security Bank', 90), ('Security Bank', 90), ('United Bank', 90), ('United Bank', 90), ('Security Bank', 90), ('Security Bank', 90), ('Security Bank', 90), ('Security Bank', 90), ('S&U', 90)]"
"STANDARDAERO AVIATION HOLDINGS, INC.",22374,Aero,309,90,"[('Aero', 90), ('Holdings', 90), ('Holdings', 90), ('Standard Trust', 90), ('Holdings', 90), ('Andar', 90), ('Standa', 90), ('Standard Trust', 90), ('Holdings', 90), ('Standard Trust', 90)]"
"Sunstone Hotel Partnership, LLC",22375,Capital Partners,24473,90,"[('Capital Partners', 90), ('Artner', 90), ('Enex 88-89 Income and Retirement Unit Limited Partnership Int 4', 86), ('Mewbourne Energy Partners 03A Limited Partnership', 86), ('American Affordable Housing II Limited Partnership', 86), ('Mewbourne Energy Partners 01-A Limited Partnership', 86), ('Mewbourne Energy Partners 02A Limited Partnership', 86), ('Borden Chemicals and Plastics Limited Partnership Units', 86), ('Feat Fund Investments Limited Partnership Units', 86), ('Imed Infinity Medical- Limited Partnership Units', 86)]"
MELLON CAPITAL IV,22376,El Corporation,16423,90,"[('El Corporation', 90), ('BAC Capital Trust IV', 86), ('CFB Capital Trust IV', 86), (""Chase Capital IV Capital Securities Series 'D'"", 86), ('Independent Capital Trust IV', 86), ('Wells Fargo Capital IV Guaranteed Capital Securities 7% Maturity 31/09/31', 86), ('Bank of New York Mellon', 86), ('Arya Sciences Acquisition IV A', 86), ('CF Acquisition IV A', 86), ('Fortress Value Acquisition IV A', 86)]"
CPI CARD GROUP INC.,22377,AR,5551,90,"[('AR', 90), ('Securities Group', 90), ('CPI', 90), ('Securities Group', 90), ('CPI', 90), ('Up', 90), ('CA', 90), ('Securities Group', 90), (""Avic XI An Aircraft Industry Group 'A'"", 86), ('CZG Ceska Zbrojovka Group Securities', 86)]"
PE ENVIRONMENTAL FUNDING LLC,22378,IRO,58092,90,"[('IRO', 90), ('ENT', 90), ('L&F', 90), ('Security Environmental', 90), ('Babcock and Brown Environmental Investments', 86), (""Corts Trust Bellsouth Capital Funding 'D' Corts 7.12%"", 86), (""Beijing Sanju Environmental Protection and NMTS 'A'"", 86), (""Anhuiyuanchen Environmental Protection S&T 'A'"", 86), ('Denox Environmental and Technology Holdings', 86), ('Environmental Infrastructure Holdings', 86)]"
"CENGAGE LEARNING, INC.",22379,Lear,2894,90,"[('Lear', 90), ('Lear', 90), ('AR', 90), ('GA Capital', 90), ('Engage', 90), ('Learning', 90), ('R R Securities', 86), ('Brightpath Early Learning', 86), ('Nobel Learning Communities', 86), ('Learning Technologies Group', 86)]"
"Allison Transmission, Inc.",22380,Allison Transmission Holdings,55505,95,"[('Allison Transmission Holdings', 95), ('Smis Corporation', 90), ('Ion', 90), ('NSM', 90), ('All Corporation', 90), ('Ans', 90), ('NSM', 90), ('MIS', 90), ('Ion', 90), ('Allison Transmission Holding Class B', 90)]"
"Express, LLC",22381,Express,46895,100,"[('Express', 100), ('GA Express', 95), ('Brakes Express', 90), ('African Express Bank', 90), ('Guardian Express Bank', 90), ('SOC Concesionaria Vespucio Norte Express', 90), ('American Express Carbonates and Chemicals', 90), ('Huayu Expressway Group', 90), ('Vietnam Expressway Services', 90), ('Flagship Express', 90)]"
Vectra Bank Colorado NA,22382,Security Bank,136665,90,"[('Security Bank', 90), ('Security Bank', 90), ('Security Bank', 90), ('Security Bank', 90), ('Security Bank', 90), ('Security Bank', 90), ('Security Bank', 90), ('Orad', 90), ('Rad', 90), ('COL', 90)]"
Great Southern Bank,22383,Southern Bank,8918,95,"[('Southern Bank', 95), ('Great Southern', 95), ('Security Bank', 90), ('Security Bank', 90), ('Security Bank', 90), ('Security Bank', 90), ('Security Bank', 90), ('Security Bank', 90), ('Security Bank', 90), ('Southern', 90)]"
"CENGAGE LEARNING HOLDINGS II, INC.",22384,Lear,2894,90,"[('Lear', 90), ('Lear', 90), ('Holdings', 90), ('Holdings', 90), ('Holdings', 90), ('Holdings', 90), ('Engage', 90), ('Learning', 90), ('Corporation Holding', 90), ('Holdings', 90)]"
