Target Name,Target No.
All America Latina Logistica SA,3992
ALLIANZ BANQUE S.A.,8407
Allianz Finance Corporation,22305
Allianz Finance II BV,16209
Allianz Finance III B.V.,16331
Allianz Leasing Bulgaria AD,3820
Allianz Managed Operations & Services SE,7754
ALPHA STAR HOLDING III LIMITED,15001
ALPHA STAR HOLDING LIMITED,14939
ALPHA STAR HOLDING V LIMITED,15015
ALTICE FINANCING S.A.,15254
ALTICE FINCO S.A.,15253
Altice France Holding S.A.,15286
Altice Luxembourg SA,15327
ALTICE US FINANCE I CORPORATION,24159
ALTICE US FINANCE II CORPORATION,24158
ALTICE US FINANCE S.A.,15321
AMPLUS ANDHRA POWER PRIVATE LIMITED,11840
AMPLUS Asset Development Inc.,14595
AMPLUS ENERGY SOLUTIONS PRIVATE LIMITED,11812
