Target Name,Target No.
PE ENVIRONMENTAL FUNDING LLC,22378
Peab Finans Aktiebolag,17590
Pearl Second Merger Sub LLC,25149
Pearson Dollar Finance plc,9210
Pearson Dollar Finance Two PLC,9364
PEBBLE BAY DEVELOPERS PRIVATE LTD,11650
PEDRA CHEIROSA I ENERGIA S.A.,4390
Pedra Cheirosa II Energia S.A.,4392
PEEL LAND AND PROPERTY INVESTMENTS PLC,9330
PEGMATITE PUBLIC LIMITED COMPANY,10993
Pekao Bank Hipoteczny Spolka Akcyjna,16976
Pelabuhan Tanjung Pelepas Sdn Bhd,15886
PENANG PORT SDN. BHD.,15860
PENARIAN HOUSING FINANCE PLC,9827
PENARTH MASTER ISSUER PLC,9385
Pendeford Mortgages No 1 PLC,9004
PENGERANG LNG (TWO) SDN. BHD.,16027
Peninsula Gaming L.L.C,21562
"PENINSULA PACIFIC ENTERTAINMENT, LLC",24976
Peoples State Bank,22123
PERMANENT MASTER ISSUER PLC,9299
