Target Name,Target No.
Phaello Finance Company (Proprietary) Limited,25595
PHBS Limited,14871
"PHH LIQUIDATION TRUST, INC.",20402
PHH MORTGAGE CORPORATION,22479
PHL FININVEST PRIVATE LIMITED,11902
PHOENIX GUARANTOR INC.,24830
Phoenix Lead Ltd,25386
Phoenix Tower Participacoes S.A.,4473
PHOSAGRO BOND FUNDING DESIGNATED ACTIVITY COMP,11017
PIC AU HOLDINGS LLC,25143
"PICASSO FINANCE SUB, INC.",25004
"Piedmont Operating Partnership, L.P.",22356
PILTEL (CAYMAN) LTD.,14742
PINE STREET TRUST I,24820
PINE STREET TRUST II,24821
PINGAN REAL ESTATE CAPITAL LIMITED,10551
PIOMBINO STEEL LIMITED,12028
Pipeline Funding Company LLC,22914
PIPELINE INFRASTRUCTURE PRIVATE LIMITED,11905
Pirapora II Energias Renovaveis S.A.,4438
PIRAPORA II SOLAR HOLDING SA,4428
