Target Name,Target No.
"SK SHIPPING EUROPE, PLC.",9348
"SK Telesys Co., Ltd",14278
"SK Telink, Corp.",14289
"SKC hi-tech&marketing co.,ltd.",14573
SkoFIN s.r.o.,7400
Skyland Mining (BVI) Limited,25314
Skyline Strategies II LLC,25171
SKYMILES IP LTD.,15045
Skysea International Capital Management,25245
SKYWAY CONCESSION COMPANY LLC,22456
SL Green Operating Partnership LP,22096
SL MACS PLC,9229
SLEEPY HOLLOW CAPITAL TRUST I,24723
SLM Student Loan Trust 2004-2,21860
SLM Student Loan Trust 2004-3,21963
SLM Student Loan Trust 2004-5,21925
Slough Estates PLC,1681
"Smart Balance, Inc.",19261
Smart Insight International Limited,25401
SmarTone Finance Limited,25280
SMARTWEB INTERNET SERVICES LIMITED,11940
