Target Name,Target No.
SONY CAPITAL CORPORATION,21209
SOPF FPF OOO,17289
SORTLAND EIENDOMSINVEST 2 AS,16613
SOUTH BEACH CONSORTIUM PTE. LTD.,17827
South Cement Company Limited,6671
South China International Industrial Materials,6845
South Coast British Columbia Transportation Au,5180
SOUTH EAST WATER (FINANCE) LIMITED,9233
SOUTH EAST WATER LIMITED,9083
SOUTH LUZON TOLLWAY CORPORATION,16911
"South Point Energy Center, LLC",22319
"SOUTHEAST SUPPLY HEADER, LLC",22298
SOUTHERN BANCORP BANK,22911
Southern Company Funding Corporation,22272
"Southern Corrections Systems, Inc.",22818
Southern Housing Group Limited,9627
SOUTHERN POWER GENERATION SDN. BHD.,16004
"Southern Star Central Gas Pipeline, Inc.",21581
Southern Water Services (Finance) Limited,9024
SOUTHERN WATER SERVICES LIMITED,9296
Southgate Solar LP,5352
