Target Name,Target No.
Tianshui City Construction and Investment (Gro,7190
TIB Card Receivables Funding Company Limited,12430
TICC Capital Corp.,19013
Ticino Vita S.p.A.,12281
TIDONG POWER GENERATION PRIVATE LIMITED,11599
TIFS HOLDINGS LIMITED,9518
TIG Capital Trust I,21454
TIN'KOFF BANK AO,17236
TISCO Tokyo Leasing Company Limited,18150
Tiverton Power Associates Limited Partnership,21792
"TIVIT TERCEIRIZACAO DE PROCESSOS, SERVICOS E T",4197
TIZIR LIMITED,9541
TLG Finance S.a r.l.,15395
TLG INDIA PRIVATE LIMITED,11835
TMF HOLDINGS LIMITED,11821
TMK Capital S.A.,15171
TML BUSINESS SERVICES LIMITED,11956
TML HOLDINGS PTE. LTD.,17841
TNB Capital (Labuan) Limited,15820
TNB GLOBAL VENTURES CAPITAL BERHAD,15993
TNB NORTHERN ENERGY BERHAD,15946
