Target Name,Target No.
Credit Suisse Securities (NL),16273
Credito Artigiano Societa per azioni,12116
Credito Siciliano S.p.A.,12254
"Cree, Inc.",19396
CREIXENT SPECIAL STEELS LIMITED,11854
CRESCOM BANK,22621
"CRH AMERICA FINANCE, INC.",24434
"CRH America, Inc.",21726
CRH Finance (UK) PLC,9252
CRH Finance B.V.,16283
CRH Finance Germany GmbH,7742
CRH FINANCE LIMITED,11005
CRH Finance Switzerland AG,5629
CRH Finland Services Oyj,8225
CRH Funding B.V.,16346
CRH SMW Finance Designated Activity Company,11086
"Cricket Communications, Inc.",21789
CRITERIA CAIXA SA,8135
Cromwell EREIT Lux Finco S.a r.l.,15398
Cromwell European Real Estate Investment Trust,17960
CROMWELL SPV FINANCE PTY LTD,3604
CROSSFIRST BANK,23822
CROWLEY BLUE WATER PARTNERS LLC,24353
Crown Castle GS III Corporation,22776
Crown Castle Towers LLC,22526
"CROWN CORK & SEAL COMPANY, INC.",22179
Crown European Holdings S.A.,8447
Crown Group Finance Ltd,3443
Crusade Euro Trust No. 1E of 2006,3377
Crusade Euro Trust No. 1E of 2007,3419
Crusade Euro Trust No.1E of 2004,3328
Crusade Global Trust No. 1 of 2004,3337
Crusade Global Trust No. 1 of 2005,3347
Crusade Global Trust No. 1 of 2006,3363
Crusade Global Trust No. 1 of 2007,3405
Crusade Global Trust No. 2 of 2004,3333
Crusade Global Trust No. 2 of 2005,3361
Crusade Global Trust No. 2 of 2006,3389
CRUSADE TRUST NO.1A OF 2005,3355
"Crystal Lake Bank & Trust Company, N.A.",22139
Crystal River Preferred Trust I,22956
CS BRASIL FROTAS LTDA,4517
CS BRASIL HOLDING E LOCACAO S.A.,4556
CS Brasil Transportes de Passageiros e Servico,4518
CSBI Capital Trust I,21510
CSC Capital Funding Limited,11053
CSCEC FINANCE (CAYMAN) I LIMITED,14974
CSCEC FINANCE (CAYMAN) II LIMITED,14987
"CSCEC Strait Construction and Development Co.,",6835
CSCEC Xinjiang Construction & Engineering (Gro,6617
CSCI Finance (2015) Co. Ltd,25344
CSCIF ASIA LIMITED,25424
CSI FINANCIAL PRODUCTS LIMITED,10529
CSJ INFRASTRUCTURE PRIVATE LIMITED.,11570
CSL UK HOLDINGS LIMITED,9884
CSLB HOLDINGS INC.,23352
CSN Islands IX Corp.,14760
CSN Islands VI Corp.,5693
CSN Islands VIII Corp.,14750
CSN Islands XI Corporation,14845
CSN Islands XII Corp.,14869
"CSOB Leasing, a.s.",18010
"CSOB Leasing, a.s.",7406
C-SQUARE INFO-SOLUTIONS PRIVATE LIMITED,12027
CSR Finance Limited,3259
CT PREFERRED TRUST II,22675
"CTBC BANK CO., LTD",17870
CTC Beaver Valley Funding Corporation,21127
"CTR PARTNERSHIP, L.P.",23920
Cullen/Frost Capital Trust II,21916
CUMBERLAND BANK & TRUST,23215
Cumbernauld Funding No.3 plc,9273
Cumulus Media Holdings Inc.,23207
CURTIS PALMER LLC,21923
"CUSHMAN & WAKEFIELD U.S. BORROWER, LLC.",24021
CUSTODIAN REIT PLC,9639
Cutia Empreendimentos Eolicos SPE S.A.,4487
CVC CORDATUS LOAN FUND IV LIMITED,11045
CVC Credit Partners European Opportunities Ltd,12465
CVEO Corporation,21401
CYBER PEARL INFORMATION TECHNOLOGY PARK PRIVAT,11752
CYBERZONE PROPERTIES INC.,16914
Cyfrowy Polsat Finance AB,17578
