ISSUER_NAME,No. 
UIL HOLDINGS CORPORATION.,24268
"PROTEOSTASIS THERAPEUTICS, INC.",24275
ENERGY VENTURES GOM LLC,24276
"UGI International, LLC",24279
"INDUSTRIAL AND COMMERCIAL BANK OF CHINA (USA),",24281
MTW FOODSERVICE ESCROW CORP.,24283
"MANITOWOC FOODSERVICE, INC.",24284
Centene Escrow Corporation,24285
MTW Cranes Escrow Corp.,24289
"Forest City Enterprises, L.P.",24293
Morgan Stanley Finance LLC,24294
"Aqua Pennsylvania, Inc",24297
Forcepoint LLC,24298
"HARBORONE BANCORP, INC.",24302
GLOBAL ATLANTIC (FIN) COMPANY,24303
"ST ENGINEERING NORTH AMERICA, INC.",24305
"American Homes 4 Rent, L.P.",24306
MGM GROWTH PROPERTIES OPERATING PARTNERSHIP LP,24307
"HEALTH NET, INC",24309
"DIGITAL EURO FINCO, LLC",24310
"PNK Entertainment, Inc.",24311
VIRGIN MEDIA BRISTOL LLC,24312
"PRIME SECURITY SERVICES BORROWER, LLC",24314
JARDEN CORPORATION.,24316
"REGIONALCARE HOSPITAL PARTNERS HOLDINGS, INC.",24317
"MGP Escrow Issuer, LLC",24318
"COMCAST CABLE COMMUNICATIONS, LLC.",24319
"ALLIANCE RESOURCE OPERATING PARTNERS, L.P.",24320
JPMORGAN CHASE FINANCIAL COMPANY LLC,24321
"OceanFirst Bank, National Association",24324
"Gold Merger Sub, LLC",24325
DIAMOND 1 FINANCE CORPORATION,24326
FIDUCIARY TRUST INTERNATIONAL OF THE SOUTH,24328
"Nina Company III, LLC",24329
"SPECTRUM MANAGEMENT HOLDING COMPANY, LLC",24330
Gogo Intermediate Holdings LLC,24331
"Iron Mountain US Holdings, Inc.",24334
HERC SPINOFF ESCROW ISSUER LLC,24336
"Coca-Cola European Partners US, LLC",24338
Bank of East Asia Ltd,24340
