Target Name,Target No.
"Sinohydro Engineering Bureau 4 Co., Ltd.",6962
Sinohydro Engineering Bureau 8 Corporation Lim,6799
Sinopec Capital (2013) Limited,25284
Sinopec Century Bright Capital Investment Limi,10410
SINOSING SERVICES PTE. LTD.,17984
Sinotrans Sailing Ltd,25311
Sirio Blue Vision Srl,12291
Sirius Real Estate Ltd,9984
Sirius Satellite Radio Inc,1727
SISAL GROUP S.P.A.,12313
SISAL PAY S.P.A.,12368
Sistema Shyam TeleServices Limited,11521
"SITKA HOLDINGS, LLC",15051
"SK Advanced Co.,Ltd.",14438
"SK BATTERY AMERICA, INC.",25032
"SK Incheon Petrochem Co.,Ltd",14415
"SK LUBRICANTS CO., LTD.",14339
SK MAGIC Inc,14528
"SK Plasma Co., Ltd",14602
"SK Shipping Co., Ltd.",14228
"SK SHIPPING EUROPE, PLC.",9348
"SK Telesys Co., Ltd",14278
"SK Telink, Corp.",14289
"SKC hi-tech&marketing co.,ltd.",14573
SkoFIN s.r.o.,7400
Skyland Mining (BVI) Limited,25314
Skyline Strategies II LLC,25171
SKYMILES IP LTD.,15045
Skysea International Capital Management,25245
SKYWAY CONCESSION COMPANY LLC,22456
SL Green Operating Partnership LP,22096
SL MACS PLC,9229
SLEEPY HOLLOW CAPITAL TRUST I,24723
SLM Student Loan Trust 2004-2,21860
SLM Student Loan Trust 2004-3,21963
SLM Student Loan Trust 2004-5,21925
Slough Estates PLC,1681
"Smart Balance, Inc.",19261
Smart Insight International Limited,25401
SmarTone Finance Limited,25280
SMARTWEB INTERNET SERVICES LIMITED,11940
"SMBC Capital Markets, Inc.",21179
SMBC International Finance N.V.,2743
SMBC Nikko Securities Inc.,13598
SMC GLOBAL POWER HOLDINGS CORP.,16904
SMFG Preferred Capital GBP 1 Limited,14788
SMFG PREFERRED CAPITAL GBP 2 LIMITED,14822
SMFG Preferred Capital JPY 1 Limited,14916
SMFG Preferred Capital JPY 3 Limited,14847
SMFG Preferred Capital USD 1 Limited,14790
SMFG Preferred Capital USD 2 Limited,14815
SMFG Preferred Capital USD 3 Limited,14821
SNCF RESEAU,8399
SNS Bank N.V.,16130
SOAR GREAT LIMITED,6916
SOAR WISE LIMITED,15022
SOBRAL I SOLAR ENERGIA SPE S.A.,4468
"Social Financing SK, s.r.o.",18022
SOCIEDAD CONCESIONARIA AUTOPISTA CENTRAL S.A.,5759
Sociedad Concesionaria Ruta del Algarrobo S.A.,5805
Sociedad Concesionaria Salud Siglo XXI S.A.,5801
"SOCIEDADE BIOELETRICA DO MONDEGO, S.A.",17077
SOCIETE AIR FRANCE S.A.,8485
SOCIETE ANONYME DE CREDIT A L'INDUSTRIE FRANCA,8516
SOCIETE ANONYME DE GESTION DE STOCKS DE SECURI,8423
Societe des Autoroutes du Nord et de I'Est de,8434
SOCIETE D'INFRASTRUCTURES GAZIERES S.A.,8544
SOCIETE DU GRAND PARIS,8631
Societe Europeenne de Banque SA,15111
Societe Francaise du Radiotelephone S.A.,8414
SOCIETE IMMOBILIERE DE LOCATION POUR L'INDUSTR,8371
Societe Marocaine de Courtage en Valeurs Mobil,15446
Society of Lloyd's,9806
Soco Finance (Jersey) Limited,12428
Sofipa SGR S.p.A.,12279
SOGECAP S.A.,8594
SOGEFIMUR S.A.,8640
SOGELEASE MAROC,15454
Solaben Luxembourg S.A.,15329
"SOLAR STAR FUNDING, LLC",23623
Solazyme Inc,23226
SOMOS SISTEMAS DE ENSINO S.A.,4266
Sonae Investments B.V.,16364
SONY CAPITAL CORPORATION,21209
SOPF FPF OOO,17289
SORTLAND EIENDOMSINVEST 2 AS,16613
SOUTH BEACH CONSORTIUM PTE. LTD.,17827
South Cement Company Limited,6671
South China International Industrial Materials,6845
South Coast British Columbia Transportation Au,5180
SOUTH EAST WATER (FINANCE) LIMITED,9233
SOUTH EAST WATER LIMITED,9083
SOUTH LUZON TOLLWAY CORPORATION,16911
"South Point Energy Center, LLC",22319
"SOUTHEAST SUPPLY HEADER, LLC",22298
SOUTHERN BANCORP BANK,22911
Southern Company Funding Corporation,22272
"Southern Corrections Systems, Inc.",22818
Southern Housing Group Limited,9627
SOUTHERN POWER GENERATION SDN. BHD.,16004
"Southern Star Central Gas Pipeline, Inc.",21581
Southern Water Services (Finance) Limited,9024
SOUTHERN WATER SERVICES LIMITED,9296
Southgate Solar LP,5352
SOUTHLAND BUILDING SOCIETY,16690
Southside Statutory Trust III,21895
SOVRAN ACQUISITION LIMITED PARTNERSHIP,21494
SOWITEC group GmbH,7823
SP DISTRIBUTION PLC,9312
"SP FINCO, LLC",24523
SP Manweb plc,9313
SP POWERASSETS LIMITED,17803
SP TRANSMISSION LIMITED,9314
Sparbanken Oresund AB,17534
Sparkasse Hainburg-Bruck-Neusiedl Aktiengesell,2866
Sparkassen Versicherung AG Vienna Insurance Gr,2854
Sparkle Assets Limited,25270
SPD FINANCE UK PLC,9496
"SPDB Financial Leasing Co., Ltd.",7060
SPE BOA VISTA 2 ENERGIA S.A.,4391
SPE Turbina 16 Energia S.A.,4372
"SPECTRUM MANAGEMENT HOLDING COMPANY, LLC",24330
SPI Australia Holdings (Partnership) Limited P,3284
SPI Electricity & Gas Australia Holdings Pty L,3339
SPI Electricity Pty Ltd,3315
SPIRIT IP CAYMAN LTD.,15044
Spoldzielczy Bank Rozwoju,16986
SPP Livfrskring AB,17604
SPP Pension & Forsakring AB (publ),17664
Springfield First Community Bank,23421
SPRINGLEAF FINANCE CORPORATION,20988
"SPRINGLEAF HOLDINGS, INC.",23730
Spy Hill Power L.P,5177
SQ REVITA I LIMITED,10014
SR-BOLIGKREDITT AS,16598
SRLEV N.V.,16266
SSIF Nevada Limited Partnership,22044
SSL ROBOTICS LLC,24927
SSMS PLANTATION HOLDINGS PTE. LTD.,17962
SSN GROUP AG,5649
St Charles Bank & Trust Company,22738
ST Engineering Financial I Ltd,17843
"ST ENGINEERING NORTH AMERICA, INC.",24305
ST ENGINEERING RHQ LTD.,9938
"St. Clair Holding, ULC",5353
"ST. JUDE MEDICAL, LLC",24451
ST. MARYS CEMENT INC. (CANADA),5142
ST. MODWEN PROPERTIES SECURITIES (JERSEY) LIMI,12471
ST.PAUL'S CLO VI DESIGNATED ACTIVITY COMPANY,11061
Stanbic Bank Botswana Ltd,4585
Stanbic Bank Zambia Limited,25653
"STANDARDAERO AVIATION HOLDINGS, INC.",22374
Stanley Works Inc,1755
Star One S.A.,4195
STARBIRD FUNDING CORPORATION,22294
STARLITE LIGHTING LIMITED,11735
"STARMALLS, INC.",16885
Start Plus Investments Ltd,25337
START UP 271 AS,16581
STARTUP INTERNET SERVICES LIMITED,11941
STARTUP INVESTMENTS (HOLDING) LIMITED,11893
Starz LLC,22445
STATE BANK AND TRUST COMPANY,24728
State Bank of Hyderabad,11488
State Bank of Indore,11495
State Bank Of Long Island,22608
State Bank of Patiala,11505
State Bank of Saurashtra,11489
State Bank of the Lakes,22780
STATE ELITE GLOBAL LIMITED,25323
State Street Bank and Trust Company,21227
STATECA LIMITED,10998
Statkraft AS,16556
STATKRAFT ENERGIAS RENOVAVEIS S.A.,4267
STB Cayman Capital Ltd.,14657
STB FINANCE CAYMAN LIMITED,14687
STB PREFERRED CAPITAL 2 (CAYMAN) LIMITED,14882
STB PREFERRED CAPITAL 4 (CAYMAN) LIMITED,14827
STC SUKUK COMPANY LIMITED,15031
STECOL CORPORATION,6968
STEEL FUNDING DESIGNATED ACTIVITY COMPANY,11010
Steinhoff Services Limited,25569
Stena Aktiebolag,17516
Stena Holland B.V.,16189
STERIS Irish FinCo Unlimited Co,11089
STERLING NATIONAL BANK,19340
Sterling Savings Bank,22204
STERLITE POWER GRID VENTURES LIMITED,11719
STERLITE POWER TRANSMISSION LIMITED,11772
"Stevens Holding Company, Inc.",24737
STG Global Finance B.V.,7927
Stock Building Supply Holdings Inc,23666
STOCKLAND TRUST MANAGEMENT LIMITED,3667
Stone Container Finance Company of Canada,5005
STONEGATE PUB COMPANY FINANCING PLC,9643
STONEGATE PUB COMPANY LIMITED,9560
Stork Acceptance S.A.,15206
STUDENT FINANCE PLC,9813
SU Toll Road Private Limited,11900
Suam Finance B.V.,7372
SUEDWESTBANK Aktiengesellschaft,7592
Sumitomo Finance (Asia) Limited,10324
Sun Canada Financial Co.,21764
Sun Capital Trust V,21884
SUN DREAMS S.A.,5785
Sun Group Finance Pty Limited,3596
Sun Hydraulics Corp,20588
Sun Interbrew Limited,2081
SUN PHARMA LABORATORIES LIMITED,11728
"Sunac Real Estate Group Co., Ltd.",6917
"SunAmerica Financial Group, Inc.",21006
SunAmerica Institutional Funding,21761
SUNBOURNE DEVELOPERS PRIVATE LIMITED,11763
SUNDARAM BNP PARIBAS HOME FINANCE LIMITED,11496
Sunlight REIT MTN Limited,10642
SUNREIT CAPITAL BERHAD,15926
SUNREIT PERPETUAL BOND BERHAD,16018
SUNREIT UNRATED BOND BERHAD,15940
"SunRidge Canyon, L.L.C.",23339
Sunshine Life Insurance Corporation Limited,6983
SUNWAY ISKANDAR SDN. BHD.,15948
SUNWAY TREASURY SUKUK SDN. BHD.,15978
SUNWAY VELOCITY MALL SDN. BHD.,15956
SuperFrio Armazens Gerais S.A.,4542
Superior General Partner Inc.,5302
SuperVia Concessionaria de Transporte Ferrovia,4110
SUPOR GROUP,6781
SURAJKIRAN RENEWABLE RESOURCES PRIVATE LIMITED,11907
"SURGERY CENTER HOLDINGS, INC.",23191
Suria KLCC Sdn Bhd,15975
SURTIDORA DE GAS DEL CARIBE S.A. EMPRESA DE SE,7330
"SUSA Partnership, L.P.",21368
SUSSEX CAPITAL UK PCC LIMITED,9957
Sutton & East Surrey Water PLC,9148
Sutton Bridge Financing Limited,14694
"Suyin Financial Leasing Co.,Ltd",7106
Suzano Trading Limited,14870
Svenska Volkswagen Finans Ab,17550
Sveriges Saekerstaellda Obligationer AB,17546
SVG Capital plc,8925
SVMK Inc,24735
SWAN HOUSING ASSOCIATION LIMITED,9717
SWAN HOUSING CAPITAL PLC,9718
"Swift Services Holdings, Inc.",23126
Swissport Financing S.a r.l.,15215
Swissport International AG,5611
Swissport Investments S.A.,15335
s-Wohnbaubank AG,2852
Sydney Airport Finance Company Pty Limited,3353
Sydney Capital Corporation Inc.,22291
SYNGENTA WILMINGTON INC.,22394
Systemax Inc,19524
T.F.S. CORPORATION LTD,3204
T.H.E. INSURANCE COMPANY,22483
T.H.F.C. (FUNDING NO. 1) PLC,9227
T.H.F.C. (INDEXED 2) LIMITED,9147
T.H.F.C. (SOCIAL HOUSING FINANCE) LIMITED,9009
TA MFG LIMITED,9726
"Tagus Sociedade de Titularizacao de Creditos,",17061
Tai Fung Bank Limited,15469
"TAI GUK PHARM. CO., LTD",14295
"Tai Shan Gypsum Co., Ltd.",6881
"Taikang Insurance Group, Inc.",6395
"TAIKANG PENSION & INSURANCE CO., LTD.",7191
Taiping & Sinopec Financial Leasing Co. Ltd.,7180
"Taiping General Insurance Co.,Ltd.",6996
TAKUGIN FINANCE (CAYMAN) LIMITED,14696
TAL Advantage I LLC,22670
TAL Advantage IV LLC,23104
Talanx Finanz (Luxemburg) S.A.,15158
Talent Yield (Euro) Limited,25333
Talent Yield European Limited,25373
Talent Yield International Limited,10651
Talent Yield Investments Limited,25252
TALOS PRODUCTION LLC,23532
Talwandi Sabo Power Limited,11600
TAMINCO GLOBAL CHEMICAL CORPORATION,23347
Tangara Energia S.A.,4353
Tanger Properties Limited Partnership,21279
Tanjung Bin Energy Issuer Berhad,15923
TANJUNG BIN ENERGY SDN. BHD.,15987
Tanjung Bin O&M Berhad,15950
Tanjung Bin Power Sdn. Bhd.,15836
Tanjung Bin Power Sdn. Bhd.,15833
"TARGA PIPELINE PARTNERS, L.P.",19737
Target Healthcare REIT Ltd,12463
TARGOBANK AG & Co. KGaA,7630
Tarjeta Naranja S.A.,2788
Tarjetas Cuyanas S.A.,2790
TARJETAS DEL MAR SOCIEDAD ANONIMA,2785
TARSHOP SOCIEDAD ANONIMA,2806
TARUN KIRAN BHOOMI PRIVATE LIMITED,11994
TASTY BONDCO 1 SA,8167
Tate & Lyle International Finance Plc,9056
"Tatra Residence, s.r.o.",18017
TBG GLOBAL PTE. LTD.,17899
"TBK BANK, SSB",24245
TCC - TRANSMISSORA CAMINHO DO CAFE S.A.,4470
TCCL (Finance) Limited,10655
"TCM Sub, LLC",22942
TCNZ Finance Limited,16666
TCP - Terminal de Conteineres de Paranagua S/A,4406
TCP Capital Corp,23387
TD Auto Finance LLC,21109
TD Bank National Association,21949
"TD Bank USA, National Association",22746
TD CAPITAL TRUST II,5466
TD Capital Trust IV,5158
TEB Tuketici Finansman Anonim Sirketi,18268
Techne Corporation,20611
"TECO Finance, Inc.",22441
Tecpetrol S.A.,2781
Teekay Shuttle Tankers LLC,3928
Teijin Holdings Netherlands B.V.,16216
"TEL FSI, INC.",18606
TELECOM PERSONAL SOCIEDAD ANONIMA,2789
Telekom Finanzmanagement GmbH,2874
TELEMAR PARTICIPACOES SA,4108
Telenet Finance Luxembourg Notes S.a r.l,15371
Telenet Finance VI Luxembourg S.C.A.,15326
TELENOR EAST HOLDING II AS,16605
Telereal Secured Finance PLC,9603
TELEREAL SECURITISATION PLC,9131
TELESONIC NETWORKS LIMITED,12040
TEMASEK EKSLUSIF SDN. BHD.,15972
Tengchong Yuezhou Water Investment Development,6979
Tengzhou Real Estate Comprehensive Development,7037
Teollisuuden Voima Oy,8203
"TEPCO Energy Partner,Incorporated",13795
"TEPCO Fuel & Power, Incorporated",13796
"TEPCO Power Grid, Incorporated",13766
"TEPCO Renewable Power, Incorporated",13820
Tequimar Vila do Conde Logistica Portuaria S.A,4541
Termeletrica Viana S.A.,4305
Terminal Quimico de Aratu S.A. - Tequimar,4512
Termobahia S/A,4182
TERMOPERNAMBUCO S/A,4160
Terra Mississippi Holdings Corporation,21313
TESCO PERSONAL FINANCE GROUP PLC,9739
Tesco Personal Finance PLC,9388
Tesco Stores (Malaysia) Sdn Bhd.,15859
Tesoro Corporation,20620
Tessera Holding Corporation,24422
TESSERACT IMAGING LIMITED,11986
TEXAS COMPETITIVE ELECTRIC HOLDINGS COMPANY LL,21805
TF VARLIK KIRALAMA ANONIM SIRKETI,18267
TG EXCELLENCE BERHAD,16023
Thai ORIX Leasing Company Limited,18128
Thai Storage Battery Public Company Limited,18028
Thai Thamrong Finance and Securities Company L,18139
Thai Union Frozen Products Public Company Limi,18108
Thaioil Treasury Center Company Limited,18167
Thames SPC,9196
THAR POWER TRANSMISSION SERVICE LIMITED,11844
THC ESCROW CORPORATION III,24510
THDC INDIA LIMITED,11610
"The Asahi Bank,Ltd.",13564
The Ascott Capital Pte Ltd,17824
The Babcock & Wilcox Company,22334
THE BANCORP BANK,24724
The Bank of Castile,22760
The Bank of East Asia (China) Limited,6430
"THE BANK OF FUKUOKA,LTD.",13502
The Bank of Holland,22425
"The Bank of Okinawa, Ltd.",12815
The Bank of Vernon,22348
The Bear Stearns Companies LLC,19158
THE BROOKLYN UNION GAS COMPANY,21652
The Bryn Mawr Trust Company,22752
THE BUSINESS BANK OF ST. LOUIS,22129
The Camden National Bank,22257
The Canada Life Assurance Company,5026
The Canada Life Assurance Company,5452
The Capita Group PLC,286
The Cleveland Electric Illuminating Company,21133
The Consumers' Waterheater Operating Trust,5071
"The Daishi Bank, Ltd.",13057
THE EAST OHIO GAS COMPANY,25005
The Edinburgh Investment Trust plc,8859
The Export-Import Bank of Korea,14193
The Farmers State Bank,23672
THE FIRST CAPITAL BANK OF KENTUCKY,22331
The First National Bank and Trust Company of O,22254
The First National Bank in Creston,23657
The First National Bank of Long Island,24519
The First State Bank,22645
The Great Eastern Life Assurance Company Ltd,17872
THE GREAT ROLLING STOCK COMPANY LIMITED,9463
"The Higashi-Nippon Bank,Limited",12962
"THE HILLMAN GROUP, INC.",22118
"The Hiroshima Bank,Ltd.",13121
THE HOME SAVINGS AND LOAN COMPANY,22694
The HongKong and Shanghai Banking Corporation,3381
The Hongkong and Shanghai Banking Corporation,10325
The Hongkong and Shanghai Banking Corporation,17790
The Hongkong and Shanghai Banking Corporation,16684
The Huntington National Bank,21254
THE ISRAEL ELECTRIC CORP. LTD.,11155
"The Juroku Bank,Ltd.",13156
The Korea Development Bank,17816
The Korea Development Bank,22390
"The Laclede Group, Inc.",20224
The Link Finance (Cayman) 2009 Ltd.,10415
The Madison Square Garden Co,22965
THE MAURITIUS COMMERCIAL BANK LIMITED,15498
The McClatchy Company,20271
The Narragansett Electric Company,20900
